text,age_label
nothing [SEP] Happy birthday  :))) [SEP] Christina is about to have a child and she's sitting here arguing with me about snow. [SEP] I'm with some flawless bitches because they mobbin pretty cause niggas love bad bitches that be on they grizzly [SEP] okay whatever,18-24
I feel so awk when older guys look at me :/ [SEP] Any hot guy that exists in Baltimore is in canton ???? [SEP] Seeing the shit men do makes it so hard for me to want marriage [SEP] Do you guys realize that they make fun of Ariana grande and big Sean because she's looks 12 and not because of the actual age difference ... [SEP] I think my cousins son has a crush on me and it's extremely cute and creepy at the same time...,18-24
"Everyone fell asleep on me ???? [SEP] Hate when like 25 yr olds are checkin me out cause I know they're not tryna be creepy on purpose but I know my age so it kinda is???? [SEP] When I'm bored I plan my future and let me tell you, in my head I got it all figured out ???? [SEP] I look like my grandmother wtf [SEP] My problem is that once a guy wants me I'm like ""well I could do better"" so I know whoever doesn't make me think that is a keeper",18-24
"I accidentally followed a sex gif page ???? that explains so much [SEP] I need to move to a place where girls look like me cause I actually hate seeing everyone else ""bum it"" all the time ???? [SEP] you can say what you want I'm the ???? [SEP] It's the funniest shit when a girl says she's gonna look nice and then wears like a scarf and a watch ???? [SEP] I wish Megan and Zoe were up so we could laugh about this together",18-24
I'm not talking about school [SEP] then what are you talking about ???? [SEP] I just mean I wanna be around more people with my style I don't wanna actually look like everyone else [SEP] I'm glad  knows what I mean [SEP] “: Niggas love the ???? emoji but don't keep it ????”preach boi,18-24
"what girls here call dressing up I call bumming it ???? [SEP] they don't look very different with it on ???? [SEP] I think me and Joey could be bffs [SEP] “:  jeans, pacsun shirt, scarf, mk watch, and uggs. ????????”lookin like a million bucks right there [SEP] I had a funny dream last night I don't think I've ever woken up laughing I just wish I remembered what happened",18-24
“: You ever just retweet something to see who's paying attention to you or whose feeling like you”no [SEP] Nacho mamas is the best place ever [SEP] All the music out right now sucks [SEP] I have a mosquito bite on my temple fml [SEP] Despite everything I'm still human,18-24
I should probably do my homework since there's nothing to do but I know I won't lol. [SEP] How the hell do I still have a headache after taking medicine [SEP] woah twins :) [SEP] “: I don't like it when random older guys wave to me... no I am 12”???????? [SEP] ty and yw(:,18-24
I can't take more than one it's migraine medicine [SEP] I just laughed really hard at this and idk why [SEP] only way out is through tho [SEP] When your friends are really white [SEP] Kim's Givenchy dress ????????????????,18-24
Why can't I be Brody Jenners GF [SEP] “: All this love on twitter but my phone looks like this  my life [SEP] something like that ???? [SEP] do it! They'll give you a free one ???? [SEP] Wow I really hate everyone,18-24
It sucks everyone graduated cause I don't look forward to any school events anymore [SEP] I really don't have any real guy friends ... [SEP] it's hard [SEP] Zoe already sleeping ???? [SEP] Is it weird I fricken love my lips,18-24
Glamour Moddel ???? had to be one lol [SEP] Did she just say she wouldn't do it for free ???????????????????????????? [SEP] Did you see how she kissed Uncle ???????????????? Nah I'm take her round the corner uno [SEP] I'm taking her round the corner IDC ???? [SEP] “: Plot twist:  Big brother shows Them what she's being saying about them”< I'm suspecting this too,18-24
"Had to be a uncle Alex init ???????????? nah this is BS [SEP] “: “: Somali twitter dont ave it ????????????????  LOOOOOOOOOL”< I'm chocking [SEP] “: Remove the niggur init”???? [SEP] “: FFS. Not gonna do anything for my birthday anymore. ????”< becuz ???? [SEP] “:  cbb everyone's useless”< Pele, come let's go shisha",18-24
"where are you ghost [SEP] “:  I don't even mind uno, hmm whatsapp me”calm [SEP] “:  Madting when? I'm available after Tuesday steeeellll”calm [SEP] “: Shawty you deserve what you've been missing lookin at you am thinkin he must be tripping ????”< [SEP] “: “: No way ????????  fgfdfffffghh",18-24
“: Mats Hummels has been backed into 5/4 from 3/1 to join #MUFC in the transfer window >  ???????? [SEP] If we get Hummels its a wrap! ???? [SEP] Fam I feel so crap! Stayin the in bed today boy [SEP] “: I have to marry someone who is just as silly as me so we can do this ???? wavy???? [SEP] “: Bobby snitched oh yea bobby snitched (oh you aint kno) ????????????????????  mud,18-24
"I'm sorry but after reading that, Ched seemed to have an intention to go into that hotel room, he lied about his reasons for needing a key [SEP] But ultimately, the question is should consent given when intoxicated be seen as being reliable? [SEP] “: Accountability is important anyway, we will never know if Ched is really guilty or not”< [SEP] Very important to note, the receptionist stated ""some footballers"" booked the hotel room. The stigma attached to being a public figure.. [SEP] .. May have been the deciding factor for Ched. As far as the law is concerned he should know better.",18-24
"But is that fair? Shouldn't we hold every single person to the same level of expectation? [SEP] Public figure or not, when it comes to the law, right or wrong there shouldn't be a greater desire to punish 1 over the other [SEP] A man's livelihood is in jeopardy now because his job is to score goals and entertain [SEP] “: OFFICIAL: Burnley and Manchester United have reached an agreement for the permanent transfer for M.Keane for £2m. #MUFC”< [SEP] Sad to see Michael Keane go, but the lad has potential and should be playing as much as he can rn",18-24
"Mad I thought man had agreed to go Liverpool ???? [SEP] were you born there? [SEP] “: How Bout Now?   Aunty knows ???? [SEP] “: Shaqiri rejected a Liverpool by saying ""No Chance"" ????????????????”< ???????? [SEP] “: This girl ain't serious ????????????  ????????",18-24
"Witches communicating with other witches ???????? [SEP] “: When you spit bars for the first time and your boy rates it [SEP] Hopefully this is the first of many necessary signings in this window! Hummels and Gundogan next please ???? [SEP] “: M.Hummels' father, also his agent, has confirmed the player will not be joining Manchester United. [ssn] #MUFC”< Damn [SEP] “: Manchester United's CB targets in January: F.Schar, Vlaar, Godin and M.Hummels. [ESPN] #MUFC”<",18-24
"“: LvG: ""Valdes joins the club as the no.2 goalkeeper and is a great addition to the first team."" #MUFC”< [SEP] “: Valdes: ""I think now David is the best goalkeeper in the world."" #MUFC”< ???? [SEP] “: Confirmed: Victor Valdes will wear the number 32 for #mufc”< Carlos' ex number :( [SEP] Hopefully this number 32 doesn't do what the last did. [SEP] Valdez is an excellent number 2! He'll get games! FA cup we can rest Dave now",18-24
“: Victor Valdes is a Red #WelcomeValdes #MUFC [SEP] I vote N.Young  #NBABALLOT #Swaggy3 [SEP] Our No1 and No2 goalkeepers are better than 3/4 of no1 on any other PL team! Not bad King Louis [SEP] “: Man Utd are better than us in every position except midfield. #AFC”< tbh minus injuries our midfield aint terrible uno [SEP] “: So unfair ????  in the space of a few hours lol,18-24
"I'm sure everyone knows what a push up bra is [SEP] “: “: Manchester United fans  ????”< ???????? [SEP] “: Steven Gerrard,""I will miss the Premier League.""  Mate, you never had it.”< love it!! [SEP] Daley Blind, Juan Mata, Angel Di Maria, Marouane Fellaini lol Arsenal ain't close [SEP] “:  Your midfield is terrible. Keep kidding yourself that Carrick is world class and Herrera is Thiago. ????”<",18-24
"Thiago is non existent at Bayern lol, Carrick is still better than half of Arsenals Midfielders at 33 ???? [SEP] who've you got? Arteta? Flamini Yh? Or cocklan init ???? [SEP] “: “: I'm sure everyone knows what a push up bra is” init. They're all acting brand new.”???? mate [SEP] clearly a push up distins or photoshop, but that's celebs for ya [SEP] No wonder Woj had a fag in the showers, he's playing with animals ????????",18-24
"tbh the only real deal you just mentioned is Santi. The rest are at their peaks now, Won't improve. [SEP] welcome to United Lad?????????????????????????? [SEP] yu need a new keeper, new CB, a DMF, another CM, a winger and world class CF???? that's more than 2 years if you ask me ???? [SEP] “:  you gotta write Nick Young so your vote will count not N. young”< oh thanks for that [SEP] I vote Nick Young  #NBABallot",18-24
"“: Only Nick Young. Never change, SwaggyP  #NBABallot [SEP] exactly. But tbh the team ain't doing a lot to help him. Yu Deffo gotta sign in this transfer window [SEP] looool I'm sure you've got your tweets saved for the 1st of Feb ???? [SEP] ""That's so Raven""???? [SEP] Dunno what happened there boy. Bad makeup?",18-24
Moyes out was a dark dark time in my life! I won't lie ???? [SEP] “:  I love K and Cs outfit ????”< ???? and Raven? [SEP] “: De Gea-esque from Valdes.  he's been watching Dave ???? [SEP] “: It's a great honor to be part of Manchester United. It's a dream come true. Thanks a lot for your… [SEP] “: Víctor Valdés will wear shirt number 32 at Manchester United.,18-24
"“: Fergie got away with replacing Ronaldo with Valencia and Owen. The man was a wizard”< genius Infact [SEP] Lampard you cheeky lad ???? [SEP] Billy is such a cockblock ???????????????????? [SEP] “: "": Better slaves? Romans 8 begs to differ lol""????”< you agree ???? [SEP] “: Yeah max is scheming still”<",18-24
???? listen I can't even say sorry anymore I'm slacking bares boy ???????? soon soon sha [SEP] “:  see you yeah at least you're being honest. For before the end of the week?”cool [SEP] Max ???? what a gg [SEP] ????I think Zoe is coming back uno [SEP] Sighs Alf ????,18-24
"Kfkdndjjdjd you know when you're speaking and see a girls face change????stop talking there and then [SEP] Dressed like James Bond without the Swave or Sophistication ???????? [SEP] “: ""That face ain't gonna look good without makeup""???????????? #CBB”< she's so flipping rude ???????? [SEP] Cammy Lee is so buff ???? [SEP] Giggsy will forever be wavy????????",18-24
Perez will be very annoying. I can see it already [SEP] You know them ppl that know everyone at a party so they make the most noise and do the most ???? [SEP] Perez is doing the most ???? I must repeat [SEP] “: United Training pics today (1/2)  ?? [SEP] “: United training pics (2/2),18-24
"Kate is a buiiiitttchhh ???? [SEP] “: When Jeremy suggested Chloe and Cami-Li wrestle, that maybe wasn't what he had in mind. #CBB”< djdjdn [SEP] Perez has info on everyone. ???? [SEP] What's the word I'm looking for ???????????????????????????????????????????????????????????????? [SEP] “: “: Alex Song's most awkward moment as a Barcelona player.  this is so peak ????????”<",18-24
Looking for my paralel line. [SEP] AND EVEN IF THEY TRYYYYYYYYY [SEP] THEY'LL NEVER TAKE MY BODY FROM YOUR SIDEEE [SEP] I wish I was not how I am. [SEP] not in my casa :(,18-24
"""Stop pretending life doesn't terrify you"". [SEP] ""Don't grow up... IT'S A TRAP!"" [SEP] ""I might not be the same, but that's not important"". [SEP] ""And I can't change, even if I try"". [SEP] ""It’s impossible to find someone who will never hurt you, so go for the one who’s always worth all the pain"".",18-24
"CUANDO TE MIRO Y NO ME MIRAS... [SEP] Prove they're wrong. [SEP] DÓNDE TENGO METIDA LA CABEZAAAAAAAAAAAAA [SEP] ""Wise men talk because they have something to say. Fools talk because they have to say something."" [SEP] We keep lying ourselves so we can feel alive.",18-24
"mis apuntes son muy top. [SEP] Kingdom of ice-olation. [SEP] I want it back. [SEP] Fuck logic. [SEP] Im back, bitches.",18-24
"BBK Live Festival, I'm on my way! [SEP] Still looking for the light that wakes me up. [SEP] ""A boy so pretty with an ugly heart"". [SEP] “Pato, I am this close to falling in love with you, but im not gonna do that to myself if you’re not ready. And I dont think you’re ready.” [SEP] NOCHE DE FLEXOOOOOO!!",18-24
"""I want her back so bad... that I leave the door unlocked. I leave the lights on"". [SEP] Pure randomness. [SEP] I have the feeling of living, but do I really live? [SEP] Brand flaming  JAJIJOJIIJAOJOADJAODAJO [SEP] ""If you give up too soon, you'll never know that you'll be missing.""",18-24
"AYAYAYAAYYAYAY VOY A VER EL NUEVO CAP DE JDTTTTTTTTTTTTTTTT #emosion #jartatac #mimuero [SEP] ""Life is a beautiful sport"". [SEP] ""The inevitable tradeoff between what is physically realistic and what is mathematically possible"". [SEP] ""Sometimes all you need is someone who cares"". [SEP] You are like the top of a mountain. The highest risk, but the highest reward.",18-24
"When everything arounds me goes wrong, it is maybe because im what's wrong. [SEP] ""Sometimes people are beautiful. Not in looks. Not in what they say. Just in what they are"". [SEP] ""You know that place between sleep and awake... the place where you can still remember dreaming? That's where I'll always love you... [SEP] ... That's where I'll always be waiting."" Peter Pan. J.M. Barrie. [SEP] This is a nice day to be a birthday.",18-24
"Night's still young. [SEP] ""I'm a little too young with not enough time"". [SEP] Good morning, darling. [SEP] ""You and me at the edge of the world"". [SEP] Will this be the 1000?",18-24
"""And when the stars come out, I wanna be with you"". [SEP] Guiri, esa worldwide known palabra. [SEP] When you don't get a joke... And you look for someone who doesn't get it either.. But you keep laughing.  JAJAJAJAJA [SEP] JAJAJAJAJAJAJAJAJJJAJAJAJAJAJAJAJAJAJAJAAJAJAJJA TAN PUTO CIERTOOOOOOOOOOOO [SEP] ""Fuck what they think"".",18-24
"Am I the bear or the honey? [SEP] ""Someday it will happen"". [SEP] Sometimes the most obvious things are the most difficult to be said. [SEP] Those pieces of you that you had to leave behind. [SEP] You Ludus while I Ágape",18-24
"The Spotlight Effect [SEP] er what? [SEP] ""Your mind tells you what's smart, and your heart tells you what you are going to do anyways."" [SEP] ""Insanity is doing the same thing over and over again and expecting the results to change"". [SEP] ""You have to be the change you want to see in the world.""",18-24
"""At the gym i'm like a ninja. You'll never see me there"". [SEP] ""This room is hot, but we could make it hotter with your help"". [SEP] Gente con gatos BASTA YA DE MANDAR FOTOS POR WHATSAPP CON ESOS SERES TAN ACHUCHABLES. Besis. [SEP] ""Sometimes tears are a sign of unspoken happiness and a smile is a sign of silent pain"". [SEP] ""When everyone else is more comfortable remaining voiceless, rather than fighting for humans that have had their rights stolen"".",18-24
"""I might not be the same, but that’s not important"". [SEP] As if nothing had happened, I suppose. [SEP] ""I cant stand to hear the silence of a busy train, where no one wants to talk for the fear of looking insane"". [SEP] today design is LoL related!  Cute poros for everyone! [SEP] Pues Finlandia se lleva muchos thumbs up.",18-24
"""In every breath I take I'm breathing you"". [SEP] ""Experience is what you get, when you dont get what you wanted"". [SEP] ""And we'll pretend that the world will never end"". [SEP] American Authors definitivamente molan demasiado. [SEP] No books, no fucking.",18-24
"""I knew she was trouble from the first case"". [SEP] On fire. [SEP] Moving everydayyy going further on! [SEP] ""The nights are long but the stars are brighter"" [SEP] Me hacen bowling. #Concepto",18-24
"""We can't keep running from who we are"". [SEP] Stuck on you. [SEP] ""And those who were seen dancing were thought to be insane by those who could not hear the music"". Friedrich Nietzsche [SEP] Hold me closer, hold me tighter. [SEP] think so pero confírmalo mejor",18-24
"Surreal. #Concepto [SEP] Parents definition of a ""Mess""????  EN SERIO ES QUE NO PUEDO CON ESTE HOMBRE JAJAJAJJAAJJAJAJAJAJAJAJAJJAJAJAJAJAJAAJAJ [SEP] Follow the path. You'll arrive somewhere. [SEP] Al fin podré twittear cosas muy ???? [SEP] Me hacen bowling por Twitter y pues yo yoro.",18-24
"#RetoDeTronos Día 1: Jon Snow. [SEP] JAJAJAJAJAJAJAJJAJAJAJAJAJAJJAJAJAJAJAJAJAJAJAJAJAJAJAJJAJAJAJAJA MUEROOOOOOOOOOOOOOOOOOOOOO [SEP] When liking lasts so long, it starts to mean something different. [SEP] chungo handshake JAJAJAJAJAJ matásme, carol [SEP] es que bitchy owner solo hay una mai lof ????",18-24
"""Hope. It is the only thing stronger than fear."" [SEP] ""then we have the other ignorant assholes who call girls “sluts” “slags” “bitches” “whores” “thots” for being confident with what they wear"" [SEP] WE'LL BE COMING BACK FOR YOU ONE DAY! [SEP] #CosasJugosas JJAJAJAJ basta de bowling joaco basta [SEP] ""You love me. Real or not real?"" I tell him, ""Real."" #HG",18-24
""": RT : "": I would do anything to make you happy"""" [SEP] #NW Fast & Furious 5 [SEP] "": RT : “: changed? no.. just realized a lot””"" [SEP] "": If they're dumb enough to walk away, be strong enough to let them go."" [SEP] I need you right next to me.",18-24
"Take me as I am, or watch me as I go. [SEP] "": Oh well, it's up to you"" [SEP] "": You aren't rich until you have something that money can't buy."" [SEP] We ain't picture perfect but we worth the picture still. ???? [SEP] I just want to ease your mind and make everything all right. So go head tell your baby mama you gon be with me tonight.",18-24
"Happy birthday sweety ???? [SEP] Goodmorning. [SEP] "": i'd sleep better with you next to me"" [SEP] Straks mn presentatie houden, wish me luck. ???? [SEP] "": "": Straks mn presentatie houden, wish me luck. ????"" - Goodluckk !"" Thankyouu!",18-24
""": "": Straks mn presentatie houden, wish me luck. ????""  Good luck ????"" thankyouuu! [SEP] "": It really sucks when you put your trust in the wrong person."" [SEP] "": “: Sometimes its better to react with no reaction.”"" [SEP] "": Some day u will think about what u gave up. And wish u could go back."" [SEP] "": Remember , u dumped me like trash .. but trash will be picked up once.""",18-24
""":  klopt. #ervaring ????"" never a failure, always a lesson. [SEP] "": Saddest thing ever ???? [SEP] "": I go through pictures on my phone sometimes and think “I wish it was this day again” and it sucks”"" [SEP] Goodmorning [SEP] "": “: I hate this feeling of not knowing what you're feeling.”""",18-24
""": i don't say much i just sit back and observe"" [SEP] "": Ready for whatever ????"" [SEP] "": You're a ? of ????."" [SEP] #NP Beyonce Ft. Jay-Z - Upgrade U [SEP] RT :  not now. < sawry!",18-24
"RT : Loyalty ain't shit these days I swear ???? [SEP] "": What goes around comes back around."" [SEP] RT : can you be mine ? [SEP] "": ""You better lose yourself in the music, the moment you own it, you better never let it go."" - Eminem"" [SEP] "": You wont break me, you'll just make me, stronger than I was. - Eminem""",18-24
""": Marshall Mathers.  I am whatever you say I am.  If I wasn't then why would I say I am."" [SEP] "": I'd rather slip and fall in shit than fall in love with you. - Eminem"" [SEP] "": Eminem's music will never get old to me."" [SEP] "": ""I would've done anything for you."" - Eminem"" [SEP] "": you really think that about me then you don't know me at all - Eminem""",18-24
""": The truth is you don't know what is going to happen tomorrow. Life is a crazy ride, and nothing is guaranteed. - Eminem"" [SEP] "": ""Don't ever give up a dream."" - Eminem"" [SEP] "": I ain't looking back only forward."" - Eminem"" [SEP] "": Feeling like you're not good enough is probably the worst thing to feel."" [SEP] "": I am attracted by looks, but personality makes me stay""",18-24
"Goodmorning. [SEP] RT : Ik ben sexy. < ohw... [SEP] "": Take off your clothes, we need to talk."" [SEP] Irritant wijf, tfoe. [SEP] hahaha precies..",18-24
""": Now that's some Relationship Goals ???????? [SEP] "": Don't let 'em say you ain't beautiful, they can all get fucked just stay true to you..."" [SEP] "": If you gone cheat.. Bitch stay single ????????"" [SEP] Say my name, say my name, if no one is around you say baby i love you. [SEP] "": Your actions define you, not words.""",18-24
"Unknown. ? [SEP] Goodmorning [SEP] "": Black R8 ???? [SEP] "": Happy Halloween ????"" [SEP] RT : "": "": And right now, I just wish you were here...""""",18-24
I'll be the help whenever you need me. [SEP] You thought that I'd be weak without you but I'm stronger. [SEP] #NP Cheryl Cole - Fight For This Love [SEP] RT :  Middelbare school songs ! < haha true ! [SEP] RT : RT : Matte black BMW,18-24
#NW Step Up All In. [SEP] Goodmorning. [SEP] #NP Jhene Aiko Ft. Childish Gambino - Bed Peace [SEP] #nw Into The Storm [SEP] De film Sex Tape is echt funny. ????????,18-24
""": I'm careful about who I trust these days"" [SEP] "": If you don't fight for what you want, don't cry for what you lost.."" [SEP] "": Food is babe. Always make me happy ????????????????????????"" [SEP] "": some things just aren't worth a reaction"" [SEP] Maybe one day we'll wake up and this will all just be a dream.",18-24
""": Those who are heartless once cared too much."" [SEP] #NP Beyonce - Diva [SEP] RT : The three C's [SEP] #NP Hopsin - ILL MIND OF HOPSIN 5 [SEP] RT : “: Surround yourself with people who bring out the happiness in you.”",18-24
"my #personality:  sociable steady open-minded . Discover yours -->  #personalitwit [SEP] What goes around comes back around. [SEP] Take me as I am, or watch me as I go. [SEP] Money can't buy your love 'cause it's over prised. [SEP] "": Smile at the bitches who hate you.""",18-24
""": Get yo stupid ass over here and love me."" [SEP] "": i hate when people waste my time .."" [SEP] "": “: "": "": The deepest pain.. [SEP] #NP Logic - Under Pressure [SEP] RT : This is so me ????????????",18-24
RT :  HAHAHAHAHAHAHA CHECK DIE GUY MET PISTOOL [SEP] Give your heart a break. [SEP] I hate myself for the way I feel about you every time. [SEP] I hate your phonecalls in the middle of the day cause all they do is just remind me that my baby is so far away. [SEP] It drives me crazy cause I need you with me.,18-24
"#NP Shakira - Hips Don't Lie ft. Wyclef Jean [SEP] "": dont fuck with my feelings i'll destroy yours"" [SEP] "": I want years ????????, Not Months ????"" [SEP] "": instead of looking for reasons to fight one another find more reasons to love one another"" [SEP] Goodmorning",18-24
Made south western lasagna and a strawberry pie last night. #texasliving [SEP] Can't wait for my paycheck!!! I'm jonsing for some pizza hard core!! #stonergoals [SEP] My kingdom for a New York slice. #munchies #homesick #pizza ???????? #eastcoast [SEP] Can't explain it but I feel so unfulfilled tonight. [SEP] Bedtime at my house is like a children's book  Goodnight Colter???? Goodnight Carson ???? ..... Goodnight Moon....????,25-34
"Got the laundry done ???? finally time to crawl into bed and try for some sleep  thinking ???? [SEP] Getting a ride from one of my roomies to the domain an hour before work to run errands ???? #winning [SEP] That 10 hour shift was way rough last night, now getting ready to pull some extra hours at the game shop cause I'm all about that cash???? [SEP] I'm watching #DantesInferno on #GetGlue [SEP] God it's so slow today (minus these 2 theaters that have like 40 people per)",25-34
"Ready for a smoke and then I think I'll be ready to finally tackle this trifle [SEP] Sitting at work waiting for my xenergy drink to kick in. [SEP] God I hate the cleaner manager over at the cinema's. what a pretentious prick [SEP] Leaving my GA with the instructions to ""guard"" #worktweet [SEP] 2 1/2 hours to freedom.",25-34
Craving chipotle so bad [SEP] Maybe I should have gotten food instead of makeup during my break #girlproblems [SEP] Hungry enough that it tastes like I've been chewing on a balloon. [SEP] Got offered the bar back position here at the cinema ???????????? [SEP] Been at this job about 4 months and I got offered the job that most people are gunning for just by minding my own.,25-34
Tbh I got nominated for this job being that at least 2 bartenders requested me by name when asked who they might want. [SEP] Late night solo rips. [SEP] This is just how I roll [SEP] Sometimes it takes all of 10 minutes for me to cycle through 12 different versions of myself. [SEP] I wonder if she realizes her make up looks like a mimes?,25-34
I think it's time for another bowl. [SEP] Not the news I wanted to hear ???? [SEP] 7 pm can not come fast enough... Not like I'll be home till about 10:30 [SEP] Ughh I am so exhausted [SEP] Trying not to fall asleep in the car.,25-34
Creepers? That's that shit I don't like!! [SEP] Feel the world beneath your feet [SEP] Sorry. Silly me. [SEP] Fuck over analyzing.... And while I'm at it... Fuck my life too ???? [SEP] It's often hard to tell if I'm being overly paranoid or overly trusting.,25-34
"sorry but I didn't post the ad that I'm credited with on your page. [SEP] I hate people who just act like my dog is dangerous just cause he's a pitbull. Fuck y'all. [SEP] The werewolf vs the vampire woman lol [SEP] Oh god. Not sure what's wrong but all my joints from my mid back down hurts so fucking bad. Hopes these tokes of THC help. [SEP] Put on ""The Possession"" and now the whole crew has been sucked in.",25-34
