text,age_label
"A competition to write fast with a 'blank' keyboard. I failed (as always) the english punctuation #sxsw [SEP] texas chicks are pretty, look at my flat-mates #sxsw [SEP] A future supervillain could born from a 3D printer #sxsw [SEP] Will QR for food #sxsw [SEP] Before talking about Glass, i'm wondering how many people couldn't be able to find the same 4/5 streets without Google Maps #sxsw",35-49
"""Humor is telling the true without the true"" Ben Huh, cheezburger #sxsw [SEP] I forgot the ritual photo [SEP] I'm seeing Designing Web & Mobile Graphics  #SXSW [SEP] Ok: 2007-2013 i'm a two times SXSW Awards winner. [SEP] with my italian austin family...        at #SXSW",35-49
"...thanks for everything! [SEP] On the way to New York, see you Austin #SXSW [SEP] the complete list of the #SXSW Interactive Awards winners, I'm in very good company: [SEP] ""Not About Us"": [SEP] and  are currently hijacking the :",35-49
"my contribution is from 'The Pandorialist': [SEP] Analog stuff:  (making of: [SEP] Food for thought: [SEP] canvas experiment of the day (or month?): [SEP] ""Sim City - Let's All Be Mayor""  Site of the Day:",35-49
"memories on the corners with the fo's and the mo' (cit.):  (via  ) [SEP] White Noise: [SEP] yesterday my eponymous site was  Mobile of the Day:  Ale'! #SVGFTW [SEP] 35 Ways Musicians and Music Brands Are Using Twitter's Vine App  via [SEP] Whoa! I have receveid a #Webbys honoree in the ""Best Navigation Structure""category:  ...",35-49
"...but I have been also nominated for a Webby Award in the  ""Self Promotion/Portfolio"" category!   #Webbys [SEP] you can now start to VOTE for  at the  's People Choice:  Thank you everyone! [SEP] Don't Fail Idaho: [SEP] The most difficult PS keyboard shortcut ever and its interpretations: [SEP] Bus driver in Red Hook:  ""I'm sorry, someone of you knows the directions?"" I'm waiting, in tears, to see the sign 'Welcome to Philadelphia'",35-49
"I could FAQ you all the time: [SEP] talks about ""I'd FAQ me"": [SEP] only one week left to choose my eponymous for the  People's Voice:   Tnx! #webbys [SEP] I'm sure they learned the lesson from ""The Gift"" by Velvet Underground [SEP] OblivUIon:",35-49
"only 2 days left to vote for  at  People's Voice!  Thank you everyone ;) #webbys [SEP] Birth of a super-villain:  (via  ) [SEP] only some hours left to choose my site for  People's Voice in ""Self Promotion/Portfolio"" cat.:  #webbys [SEP] ""But I'm A Nice Guy"": [SEP] who watches the men's watches?",35-49
"if your elevators are always busy, there could be one reason: [SEP] i will miss Drawn.ca :-/ [SEP] ...and also ""Epic Playdate"": [SEP] Connecting the tweets/dots [SEP] ""hello? Yes, this is #dog"":",35-49
"By the way, product placement [SEP] how many living music genius do you know? For me, one of them is this guy that has a new album out: [SEP] ""I'd FAQ me"" is  Mobile of the Day :) [SEP] proud to have worked in the  team for an epic (and crazy) project. Its name is Google Loon.  #loon [SEP] natural photographic cropping:",35-49
":-) one time i'd like to create a site with only nested tables and <marquee> tags placing a bottom-left logo ""Netscape Experiment"" [SEP] thank you so much, Ricardo! Good luck and be shape :-D [SEP] can't wait for the Web Speech API support in IE 15 [SEP] the drawn+voice over style let me think about this masterpiece: [SEP] trying to complete my first LeapJS prototype the day before the  launch",35-49
"The chicken temple [SEP] today is the one year anniversary of my Atlantic crossing: [SEP] check my new experiment ""Hover the top"", a simple clickless interface for 's #LeapJS: [SEP] sure, I will do it. At the moment the default duration is 2 second, I will set it to 1/1.5 [SEP] ""Why Quantity Should be Your Priority"":",35-49
animation-iteration: cats   (by ) [SEP] only four days to new and hilarious gags: [SEP] new project for  at : [SEP] vote for the #outasyou panel by  and  at the SXSW 2014: [SEP] I think #theworldneedsmore #education. What do you think the world needs more of? Visit,35-49
I wanna thank my mom for giving me a cool ass name [SEP] Aaron Alexy Nilo Thomas [SEP] And all I ever wanted was to act on my attraction [SEP] I wish I could close my eyes and I automatically fall asleep [SEP] I just wanna go to sleep so I can wake up in the morning and defrost those tamales that are in my freezer ????,18-24
"Probably tomorrow? [SEP] from 9-9:50 then my second class is at like 1 I think [SEP] I need to find me a girl that loves Harry potter, Pokemon, and listening to music just as much as I do. [SEP] Me everyday [SEP] Alright I'm putting my phone down nobody bother me with notifications. Pfft, what am I saying my phone stays dry as fuck. Night",18-24
"of course my room would be cold, and my blankets comfy as hell the day i gotta get out of bed early. [SEP] Shits looking up for me. Ima have a or semester of school this year [SEP] Shits looking up. Ima have a dope semester this year [SEP] She say she love my drive i love that she drives me crazy [SEP] Woke up 10 minutes before I got to get to class. Aaaaand it begins",18-24
"Professor walks in the class doesn't say a word, goes straight to her computer goes on YouTube and plays a Nas song. Love this class already [SEP] All my classes and professors seem cool as fuck. [SEP] Everything is COOL except my body cause I'm walking to my car which is out in bumfuck Egypt wearing sweats in 102 degree weather. [SEP] I know. I ain't blaming anything on anyone though. Lol [SEP] Bruh fuck all this traffic!!",18-24
More rest and sex is all a nigga need. [SEP] Say she love me for my drive I love her cause she drive me crazy [SEP] Thinking if I should smoke then sleep or just sleep [SEP] I stay in the shower for like 30 minutes just standing under the water thinking about important life decisions [SEP] It's so hoooooot. :(,18-24
I want a five guys burger [SEP] Ordered a burger through the phone so they have it ready by the time I get there ???? [SEP] I got home from school and i KNOCKED THE FUCK OUT [SEP] Texas Government class is boring as fuck. [SEP] Is it just me or does a females mind intrigue y'all more than her body,18-24
"Mariachi Auditions? Get my accordion Pedro we're gonna be mariachis! ???? [SEP] Discussin life and all our common goals, smart kids that smoke weed, honor roll. [SEP] Too many girls in this world to be caught up with some other dudes bruh. [SEP] Having class on a friday sucks. [SEP] The peace sign is just the trigger and the middle finger.",18-24
"A girl can be fine af but if she's dumb, then i don't even know man. That's tough [SEP] This rain is A1 [SEP] That thunder set off people's car alarms. Holy shit ???? [SEP] I hate madden man, that shit bores me like no other [SEP] My room can't stay clean for more than one day",18-24
In December i will have my twitter for 4 years. [SEP] I remember when i made my twitter [SEP] It was junior year. I went to high school at bears for 1 semester and I made it in my history class because I was bored [SEP] Cigarettes on cigarettes my momma think I stank [SEP] I just downloaded a lot of new music,18-24
"You see I'll never get, why the earth is a puzzle that I'll never fit. [SEP] Raspas! I've been craving a raspa [SEP] There's an odd feeling of satisfaction about laying in a cold room with nothing but the sound of music [SEP] Should really buy my text books now [SEP] Is money really the answer though?",18-24
I need to change my ways. [SEP] Tell me something I don't know [SEP] When my room is clean I feel like I have my life together [SEP] I need to immerse myself in a few good books [SEP] I could go for some late night whataburger right now.,18-24
"I need to completely cut out smoking and drinking and replace it with my fitness, and school [SEP] It's hard but it's not impossible [SEP] I think it's time I start picking out who I do and don't need in my life. [SEP] I gotta shut shit down be a man pick friends all selective now [SEP] I go on my trips sometimes but who doesn't?",18-24
"I chase money like a hard to get female then throw it back up in the water like a seashell. [SEP] I just wanna be who I am [SEP] I was supposed to read the first chapter from a book I haven't even bought yet by tommorow [SEP] Tables turn, bridges burn, you live and learn. [SEP] Can't wait to live out on my own again",18-24
I was supposed to wake up earlier than usual but snooze buttons exist. So yea you get the jist of it. [SEP] I wish I was able to wake up early. [SEP] Let me rephrase that. I wish I was able to get out of bed right after I wake up early. [SEP] Treating my mom to some Olive Garden cause she deserves it. [SEP] Happens to the best of us RT “: True life:  I cry in my car b4 class”,18-24
"Am I the only one that asked what a ""Super Salad"" was the first time I went to Olive Garden? [SEP] I put earrings today after the longest time, and i already took them off. [SEP] I want my backpack I ordered to arrive already ???? [SEP] I'm trapped in my conscious [SEP] fuck yea dude. Its totes wicked!",18-24
What's the hol up [SEP] I need my own car already man relying on rides is such a draaaaag. [SEP] Learning to make music is hard and not easy but that's why I like it [SEP] Ima bad muhhfucka straight down to the bristle [SEP] Ima take a quick nap before work,18-24
"I need like at least a half a day nap. [SEP] “: If you find a solid, moraled woman, don’t be an idiot and do things to lose her.”   Or learn the hard way. Like me... [SEP] Sometimes I gotta pause the hip hop, and play some indie rock. [SEP] When I listen to awesome music I want people to be around me so we can enjoy the awesome music together [SEP] This song holds many memories.",18-24
I will have a model wife [SEP] 5 rts and I'll yank the girl that sits in front of me hair. [SEP] & I'll snapchat it [SEP] Gotta be by 9:50 cause that's when class ends [SEP] Aww shit tf did I get into,18-24
Jk guys that's rude I'm not mean to my peers [SEP] Who ju calling a puss? [SEP] I like being one of the very few black people in my school. [SEP] Black student union? Tf is bsu? [SEP] She looks like a cookie?,18-24
"I'm sitting down minding my business and some girl is walking and staring at me so then she stops and starts waving. [SEP] At first I'm confused cause idk who this girl is or if she's even waving at me. She's like 'do you remember me?' I'm like Nah. [SEP] Apparently I sold her some shoes at Zumiez. lol [SEP] I hold the door open for a girl and she don't know how to respond to my courtesy she's like, ummmmm thanks? [SEP] I always wonder how people perceive me as at first look.",18-24
"How to Test Your Startup Idea for $50 [SEP] You've been quoted in my #Storify story ""New Story"" [SEP] New Story  #storify #caceroludos [SEP] You've been quoted in my   #Storify story #caceroludos [SEP] You've been quoted in my   #Storify story #caceroludos",25-34
"You've been quoted in my   #Storify story #caceroludos [SEP] Business models are a commodity Stop asking ""But how will they make money?"": [SEP] Y Combinator Alum Flutter Raises $1.4 Million For Gesture Recognition Tech [SEP] Montreal Protests, 4 Months In (photos)- The Atlantic [SEP] ""I don't want to archieve immortality through my work... I want to achieve it through not dying.""  Woody Allen",25-34
"Por comer en la oficina d Lvk ( St. Andrews) [SEP] take it easy ! [SEP] I'm at Aeroparque Jorge Newbery (AEP) (Ciudad de Buenos Aires) w/ 7 others [SEP] , your Klout Score is decent (I'm a 53). Check out your  profile today! [SEP] Just posted a photo",25-34
"Just posted a photo [SEP] a torrar ? [SEP] I'm at Aeroparque Jorge Newbery (AEP) w/ [SEP] I just unlocked the ""Swarm"" badge on ! [SEP] Just posted a photo",25-34
Los yankis bailan cuarteto pero despasito ! :p ( Edinburgh Castle w/ 3 others) [SEP] A lot people with pride [SEP] Just posted a photo [SEP] Just posted a photo [SEP] Just posted a photo,25-34
"Just posted a photo [SEP] I'm at Powell Street Cable Car Turnaround (San Francisco, CA) w/ 2 others [SEP] I'm at San Francisco Pride (San Francisco, CA) w/ 52 others [SEP] I'm at Civic Center Plaza (San Francisco, CA) w/ 23 others [SEP] Just posted a photo",25-34
"Smirnoff girls [SEP] Just posted a photo [SEP] Just posted a photo [SEP] I'm at HI San Francisco City Center (San Francisco, CA) w/ 2 others [SEP] Just posted a photo",25-34
"Naked men all over the pride [SEP] Just posted a photo [SEP] All over the city [SEP] ""Go to R Bar. Get a group of friends and take a Fernet shot.""  R Bar via Anna M.:  #4sqTip [SEP] Just posted a photo",25-34
"Geeky meeting near the gate [SEP] I'm at 500 Startups (Mountain View, CA) w/ 6 others [pic]: [SEP] I'm at Google HQ (Mountain View, Ca) [pic]: [SEP] I'm at Googleplex - Google Store (Mountain View, CA) [pic]: [SEP] I'm at Googleplex - Steam Cafe (Mountain View, CA)",25-34
"I'm at Google Android Camp (Mountain View, CA) w/ 2 others [pic]: [SEP] I'm at Computer History Museum (Mountain View, CA) [pic]: [SEP] Hard disk of late 60s. It still works ! [SEP] thanks for receiving us this afternoon, u r very cool people and inspired us to follow your steps [SEP] Good morning SF",25-34
"Google Engage ( Googleplex - 1900) [pic]: [SEP] I'm at Googleplex - Long Life (Mountain View, CA) w/ 3 others [pic]: [SEP] Jelly bean it's here ( Google Android Camp w/ 2 others) [pic]: [SEP] People of  rocking at #google #io12 [SEP] It's a Startup world  google #io12 #gdg",25-34
"I'm at Google I/O 2012 w/ 18 others [pic]: [SEP] ""Only 10 percent of USA citizen has passport, this is awful truth"" [SEP] Just posted a photo [SEP] I'm at Pancho Villa Taqueria (San Francisco, CA) w/ 5 others [pic]: [SEP] I'm at Dalva (San Francisco, CA) w/ 3 others [pic]:",25-34
"""Mission bar Dalva was named after a a book of the same name by Jim Harrison.""  Dalva via :  #foursquare [SEP] ""SF Weekly’s Best Of 2011 Winner – Editorial Pick – BEST BAR INSIDE A BAR...""  Dalva via :  #foursquare [SEP] I'm at Mashery (San Francisco, CA) w/ 2 others [pic]: [SEP] I'm at Mashery (San Francisco, CA) w/ 4 others [pic]: [SEP] I'm at Off the Grid: UN Plaza (San Francisco, California) [pic]:",25-34
"I'm at Apple Store (San Francisco, CA) w/ 5 others [pic]: [SEP] I'm at Hilton San Francisco Union Square (San Francisco, CA) w/ 2 others [pic]: [SEP] I'm at Jasper's Corner Tap & Kitchen (San Francisco, CA) [pic]: [SEP] I'm at Helen Wills Playground (San Francisco, CA) [pic]: [SEP] I'm at Lombard/Hyde Cable Car Stop",25-34
"I'm at Fisherman's Wharf Sign (San Francisco, CA) w/ 3 others [pic]: [SEP] I'm at Bubba Gump Shrimp Co (San Francisco, CA) w/ 3 others [pic]: [SEP] I'm at Apple Store (San Francisco, CA) w/ 7 others [pic]: [SEP] I'm at Disney Store (San Francisco, CA) [pic]: [SEP] I'm at Code for America (San Francisco, CA) w/ 10 others [pic]:",25-34
"I just unlocked the ""Greasy Spoon"" badge on  for checking in at diners! Bring on the burgers! [SEP] I'm at Pinecrest Diner (San Francisco, CA) [SEP] I'm at HI San Francisco City Center (San Francisco, CA) [SEP] 4th of J gringo party ( Cova Hotel w/ 2 others) [pic]: [SEP] I'm at Bigfoot Lodge (San Francisco, CA) [pic]:",25-34
"I just unlocked the ""Great Outdoors"" badge on  for checking in at outdoor spots! Freedom! [SEP] I'm at Chinatown Gate (San Francisco, CA) w/ 2 others [pic]: [SEP] I'm at Chinatown (San Francisco, CA) w/ 3 others [pic]: [SEP] I'm at First public school In California (San Francisco, CA) [pic]: [SEP] I'm at Sue Bierman Park (San Francisco, CA) [pic]:",25-34
"I'm at Vaillancourt Fountain (San Francisco, CA) [pic]: [SEP] I'm at Embarcadero Center Walkway (San Francisco, CA) [pic]: [SEP] Grain salad +salmon and Heretic evil twin beer ( Jasper's Corner Tap & Kitchen w/ 3 others) [pic]: [SEP] I'm at Chinatown (San Francisco, CA) [pic]: [SEP] I just unlocked the ""Overshare"" badge on !",25-34
"I'm at Chinatown Gate (San Francisco, CA) [pic]: [SEP] I'm at GitHub HQ 2.0 (San Francisco, CA) [SEP] I'm at 303 2nd Street Plaza (San Francisco, CA) [pic]: [SEP] I'm at Los Compadres (San Francisco, CA) w/ 3 others [pic]: [SEP] I'm at South Park (San Francisco, CA) w/ 6 others [pic]:",25-34
"Just posted a photo [SEP] Just posted a photo [SEP] Just posted a photo [SEP] I'm at The Women's Center (San Francisco, CA) [pic]: [SEP] I'm at Bi-Rite Creamery (San Francisco, CA) w/ 5 others [pic]:",25-34
"""If you fight for a cause then fight for a cause!""  #riots #truth [SEP] Wow. This is a really REALLY cool Wheatley. [SEP] Do you still model props/build levels for your current games or is it purely designing and delegating? [SEP] RT : 'DRM scheme that ENCOURAGES piracy is insane.' [SEP] No, dear god, no. You should buy something like this instead. It's even red&black!",25-34
This is cute and stuff. [SEP] Seems my Lowpoly Contest is quite a success. I wonder how many more people enter during this weekend... [SEP] More like Designer From Hell... Semi-bold is a perfectly valid request: [SEP] It looks like... LG has finally pushed an upgrade for my phone!?¡¿ No more Android Cupcake 1.5! [SEP] Yesssss. Yes yes yes. It's now running froyo 2.2.2.,25-34
"If I ever turn out to be absurdely rich, I'm going to buy a Clenet. [SEP] No offense, but [insert offensive words here] [SEP] : any specific reason there's so much whitespace? You can easily have the wings twice as big as they are now, if you optimize the UV. [SEP] So... I just realized that the 2 series I like most are House, and Castle. Fun coinkidink. [SEP] RT : ""Our TF2 art thread has nearly 4 THOUSAND more replies than the WAYWO threa."" But it's also over twice as old... ;)",25-34
"This short movie is brilliant! Everyone who does 3D art will love it: [SEP] This makes me feel so sad: RT : : The future of games at retail [SEP] That's because Eskimo's don't have all that many words for snow. The Sami, however, do. [SEP] So this 3D marketing trend has really gone too far now. Why? 3D toothpaste... [SEP] RT "": I spent a week in Boston while my son was having a medical procedure done.""   Is he a Strogg now?",25-34
"Well, this got a crapload of responses... [SEP] RT : ""A guide on how to get more free space with Dropbox!  Retweet for a chance to get +100GB!"" Mmmm. Spaaace. [SEP] Screw you, Garshasp. After wrestling with clunky controls for 4 hours, your last savegame is 3 hours ago? *Installs Prince of Persia* [SEP] Yup. We're living in the future. Invisibility  holograms  and 'free' energy [SEP] Worst news I heard about my country in a looong time:  Stupid copyright hypocrits.",25-34
"The DLC is sold as 'steampunk' and not as 'christmas' pack, so I see no reason for it to be temporary. Not 100% certain, though. [SEP] - took a couple of minutes to whip this up:  PSD: [SEP] Are you sure you want to know that? [SEP] Just saw a well-dressed man casually whacking the bejeezus out of a boxing bag with an umbrella. I'm done for today. [SEP] Steam just broke the 5 million user barrier!  statistics&data:",25-34
"Made a background today. Warning: it's a bit bright. [SEP] Dont worry bro! I h4xx0r3d the website to work via this link:   Good luck with your [nothing]! #confused [SEP] I think I should write more stuff. Articles, tutorials, plotlines... [SEP] Steam. For phones. What magic is this!? [SEP] Pineapple Smash Crew. Buy it. Play it. Enjoy it.",25-34
"We'll probably see some launch titles for the new xBox running UDK 4. I wouldn't be surprised if some corp's already have access. [SEP] So far: bad, because they're not used well but as a substitute for real goals & gameplay. Design games, not achievements. [SEP] *** BlackBerry App World Notification - Vendor Approved *** [SEP] Latest WIP of Teddy Protector: [SEP] damn adobe and their inconsistencies damn RIM for not having compliant sofware damn Unity for not running on Dalvik but on Mono",25-34
"but most of all, damn me for finding things out too late. =( [SEP] 1 more way games are less forgiving: if you suck, you can't play any further. (first 45 sec) [SEP] Good luck trying to get some sleep the next couple of days. And the ones after those... and those... [SEP] Thank you, Google, for understanding what I mean when I'm too tired to type well. [SEP] Thought I'd let you know: your game reached Kotaku  and me and some other commenters would like to know more.",25-34
Cheap gamers rejoice!  is a Steam-like program that lists 300+ FREE games. (comparison: Steam has ~1575 games in total) [SEP] 5 years? Where was it at that time? The earliest I can think of is in Dr. Petter's Sculptris app. [SEP] So... Spotify is working on an online radio service? But they can't even keep their normal servers up&running... #spotify #priorities [SEP] Today's the 4rth time in about a month that Spotify lost its connection. You guys really need to fix server stability. [SEP] I got a 9.3/10 in  . Booyah! Bow before my color-controlling cortical cones.,25-34
"Built a Crush the Castle level. Now I'm a real game designer, right? [SEP] NBA2K13 and Need for Speed: The Run don't have 16-player online either; does that make them bad games? [SEP] I ordered one Friday but the store had no stock. Do I still get the $25 when they get stock? After all, I 'bought' yesterday. [SEP] "":   turbosquid's reply to someone selling my IP on their marketplace"" Goddamnit, Turbosquid... Sigh. [SEP] Dear Kotaku. I like you and all, but please learn the difference between parkour and freerunning.",25-34
"""How Portal 2 Developers Became The Best 6th Grade Physics Teachers Ever  "" Much better than Oregon Trail. [SEP] is not one band. It's one band, and an unrelated hiphop project. They shouldn't be merged because of the name. [SEP] Do you mean Die Antwoord actually asked for it in a tweet or something, or just that they would work well as models? [SEP] Got a bit of extra work done on my sideproject, SomeHumans. Just some website mockups for now. Like? No like? [SEP] Pay what you want, help charity, and get 7 epic THQ games for Windows via Steam + awesome soundtracks!  SAVE THQ PEOPLE!",25-34
"I just wanted to say that it's refreshing to see such big news (the chapter 11) delivered clearly and without PR lingo. [SEP] I beat the minimum and now own The Xmas Bundle 2.0  via [SEP] Oooh... interesting stuff. A (linux based?) Steam console type thing. [SEP] Yay! My strip of silver finally arrived in the mail! [SEP] Just wanted to say thanks for the treasury of useful, interesting information you put out. A must-watch for every developer.",25-34
"What happened guys, did the server crash? Or are you transferring to a new host or new software or something? [SEP] Playing Guitar Hero, soundcard crashes. Finished the set list anyway. =D [SEP] Xbox is going to be the new watercooler.. wait-what? Go home Xbox, you're drunk. [SEP] As of today I've got over 400 games on steam... and about 100 I've never played. Never gonna get rid of this backlog am I? [SEP] Hey I just saw you on KickStarter. I saw the game logo and immediately saw a cool ambigram possibility.",25-34
"I never thought I'd be amazed by tearing/crumpling paper.  #siggraph #3d [SEP] Looks like Sony is 'winning' the E3 this year.   #E3 #PS4noDRM #399USdollars [SEP] You're aware that the vast, vast majority of the U.S. doesn't have exactly great broadband either? [SEP] 2013 #noDRM Summer Sale on : Torchlight for FREE, 500+ Games 50% off, Daily Deals up to 90% off! [SEP] Ooh, and game-sharing might be on Steam in the future... Nice!",25-34
"Stayed the same? No. Gone down.  Because inflation. You should know that, Mr. Bachelor's. [SEP] If you play just the campaign, you're not buying all the DLC maps packs, are you? [SEP] Which means that if the price stays the same ($50 back then, $50 now), with less value per dollar, games are lower value/cheaper. [SEP] We want games to be BETTER. If we go for cheap as the primary factor, we end up with clones, free-to-pay and social-exploitation. [SEP] R.I.P. Douglas Engelbart. Father of the Mother of all Demos. We owe you so, so much.",25-34
"Just installed the new #Opera browser version. Dear god. ó_ò All the features are gone. It's like going from Word to Notepad. T_T [SEP] Just bought the Huawei P1 via . Really great deal at €204,34 (shipping included). [SEP] This is a pretty interesting game based entirely on talking: [SEP] I wanna have a game out and playable by Januari. There. I've said it. It's out in the world now. [SEP] Thanks for the  article, having positive examples of games is great. Are you aware of 's ""Games for Good""?",25-34
"Uncooperative and/or slacking students make for a bad learning environment. [SEP] Just bought two music CDs this week (Machinæ Supremacy and Mustasch, if you must know). That's the first time in, what, 5 years? [SEP] A poly is several things. :P [SEP] This looks like it could be an interesting series. ""Fixing Blender"" on GUI design [SEP] This is some nice cross-media comic work. Read it. Read it now. (don't worry it's only five pages)",25-34
"Just -almost- lost my entire site when trying to change folder organization. Thank you, universe, for hinting I should back-up more often! [SEP] Thinking about consoles in 2017. With Sony's PS4 dev tools launch games will look better, but we'll see less improvement over the lifecycle? [SEP] Well. This is dumb. If you make a bad  game, suck up the criticism and make better ones.  via [SEP] Not wasted time though. More like a PSA. It's good that you show us the worms in the can at times. [SEP] So far (just been using it for a month) I like  a lot, but I don't really agree with their new pricing schemes. Mhmm...",25-34
