text,age_label
"Getting up at 5! a rare case for me. and that is also without any reason! Enjoying the morning after a long time. [SEP] amar chokhe thont gaale tumi lege achho amar angul haate kandhe tumi lege achho amar deoyal ghorir kantay tumi lege achho. [SEP] Main hoon naa. don. veer zaara. heyy baby. unreleased don2 [SEP] listening to the one song repeatedly for almost two hours. like it more I hear it. [SEP] enjoyed the journey back from home. thanks to ""deoyal ghorir kanta"" and one who sent me the song.",25-34
"Commemorating the day.... [SEP] ""Joy of giving love is more than recieving."" really? [SEP] There was a time I wished somebody could understand me. But now no one can see beyond my mask . [SEP] The call that never came... [SEP] When someone talks to you smiling (unnecessarily) use a warning message that you are about to fall in a deep trouble.",25-34
I want to break the wall. I want to be free. This is just killing me. [SEP] There was a time when I thought myself perfect and did so much wrong. Now I realize how wrong I was. I am sorry........... all of you.. [SEP] Now it is my turn... [SEP] Get ready for destruction... [SEP] And this is the over.... and the end is near...,25-34
good to hear that. [SEP] who got the lottery? [SEP] RT : RT : Happy Birthday Google. You have helped me look smarter than I am on several occasions. [SEP] Good to see smile back on the face of the dear ones. [SEP] Can someone plz do the coding for me... I am tired of doing the same thing again and again.,25-34
"It seems the excitement around 'like' has ceased now. I knew this a long time ago. [SEP] A not so great thought of a great person: ""After marriage life is going to be completely different adjusting... [SEP] Well, finally bid good bye to a very close person. Don't know if we will meet again or not. Hope we do. Will miss you. [SEP] Am online in Facebook chat... after ages... [SEP] In a great mood... code running in the back ground...",25-34
"All right... it's done.. so it is holidays...... [SEP] Returning home, tired, late. Worse: train is packed. Worst: clouds in the sky. The best combination for the worst journey back home. [SEP] Good morning. Got up early. A special day (not necessarily happy). Got some work to do as well. [SEP] Wore my favourite dress. After almost an year. Love everytime wearing dhoti. suits me as well. [SEP] So another day passes by. Sometimes love, frnds.. these seems so childish. Better to be single.",25-34
The largest festival around this part of the country begins... Sometimes it seems such waste of money. But seeing... [SEP] Went to local pandels today... saw 8+2 deities.... ;) liked d plus two. a long days ahead with plan finalised for... [SEP] Thank you guys... you made my day... Looking forward for more tomorrow... [SEP] The best day of the year undoubtably .... Ohhhh... I enjoyed it to the fullest. And Ganguly was the most wonderful... [SEP] A fresh and good morning... some experiences expected today... cant wait...,25-34
"Well..... I enjoyed the day at Zoug... I guess spelling is correct. Enjoying the colorful night. [SEP] Well that is the end of the day... enuf of pandels and deities... went to some of the most incredible ones. Damn... [SEP] Reached home... Lying in my bed... sleep is nt far away. [SEP] Good morning and suvo maha navami... Today I need a break... Too much hectic 2 days... [SEP] All right... sorry about an older post... I actually misspelled it. For the google buddies, now search with the...",25-34
A very sleepy morning and just hours left before I go out for a small trip... feeling to sleep all day... [SEP] Yeppi.............. Good old (really??) starting days are back [SEP] People think they are so good and perfect. If it was so they did not have so many problems in their lives.   P.S. I am not perfect. [SEP] Now I am waiting to see a cat fight... In FB. Got trapped in your own trap I guess. [SEP] Gold is so easily available this days... Who complained about the price rise?,25-34
"A thought just before I sign out, I am the dumbest person in the world, and I make the same mistakes over and over again. [SEP] You dont hv any idea wht I am going through [SEP] Moral of the story. If a girl post anything confusing or even a garbage in FB it will get enuf comments so dat you... [SEP] Waiting for some jokes??? Just view some FB posts... hillarious. [SEP] At Chakradharpur. Feeling tired after a long journey. Hope to be a pleasant day today.",25-34
A break in the busy life. Strike makes it possible. Loving it. also enjoying doing fb. [SEP] Finally free... got rid of it. [SEP] what u said is nt clear. [SEP] Best way to win for RCB. Allow the opposite team 200 runs. [SEP] Splendid Hirni... will post photos soon.,25-34
End of day and end of Journey what is full of some wonderful views. Cannot post now aas no computer is available.... [SEP] Had a very loud and provocative alteration with someone I really respect a lot. When shall I be able to control... [SEP] I just lost my cool... forget n forgive... [SEP] while in roaming... osn is the best way to communicate. [SEP] just too much heat taking its toll. feeling exhausted.... still felt good to be back in WB. seems so much at home.,25-34
"Back home. just enjoying doing nothing. [SEP] Monday blues... now I know it. Must recover quickly or hv to see red all day. [SEP] Just a simple thought, not necessarily correct, people access online social networks more when they feel alone and sad... [SEP] the whole thing is that ke bhaiya... I am also using it... [SEP] I am also using the OSN so much... what do you think the reason is?",25-34
"well... sort of... [SEP] ha ha... if I dont use OSN, hw ud I knw wht u say.. [SEP] How to do it??? It's a mystery... and I dont know the solution [SEP] All right... I don'r want to know. [SEP] All right. I don't want to know.",25-34
Not feeling well... A lot left to do as well. huh... I thought I was just ok with what I am now. [SEP] In the middle of too much controversy the original reason to create the page got lost. Hopefully we start it from tomorrow. [SEP] Good morning guys... feeling better today... Expect some bombardment today... [SEP] The best picture taken by me till date... [SEP] the question is who is the 5th one? tweet people plz ignore it.,25-34
"New facebook mantra: ""The enemy of my enemy is my friend"". [SEP] Okk... thought of the day... ""LOVE"" is not saying ""I Love You"" everyday. Rather it is to mean it... [SEP] All right GN folks.. take care... May be I need it most. [SEP] Hello and good morning... Heavy head feeling... and not a hangover (I swear I didnt drink). I need some pure rest, I guess. [SEP] OK.. start the day with a disputed statement. People say they are modern, but they allow others to be modern only...",25-34
"Sometimes I feel good to be busy, but at the end of the day I really feel very weak. [SEP] It feels good when you are surrounded by happy faces. None likes others to cry, I wish all my friends gets happy. [SEP] Good morning... The first question remains ""What is so god about this morning?"". [SEP] Feeling so tired mentally and somewhat physically as well that I am not in mood to get into any more trouble... Please leave me alone... [SEP] I need a govt job. So no headaches, no burdens, no workload; best part, long idle times...",25-34
Copy paste... cholchhe.. cholbe.. [SEP] feeling weak... n hv to keep going for another hour. plz.... help me. [SEP] Feeling better.. Though hv fever. Hv to be fit b4 tomorrow. [SEP] Don't hesitate to take the opportunities when you have some. You may not have again when you need them. [SEP] Listening to FM after ages (not literally). Good to hear some fav numbers...,25-34
"Missing a friend very much... somebody inform her... [SEP] Seeing a doctor... :( no other option. Have to go to ISI tomorrow at any cost. [SEP] Morning guys... not so good for me ofcrs. Good to see some frnds njoyin life finding touchy stories what they want in their lives as well. [SEP] interesting. A post here got completely unnoticed whereas when the same posted by a girl in her FB wall got 9... [SEP] hitting the road again. always liked the journey through national highway at night even it is on 79. chhote log, chhote batein.",25-34
Eventually made time to hear my fav singer's song with full concentration and getting the meaning. sheer... [SEP] Listening to my two fav singers of Bangla and English. Enjoyed the the journey apart from the pollution saying welcome to Kolkata. [SEP] Back to semi normal life. But surely need more rest than anything else. [SEP] Really weakened by the virus. cannot sit for long. [SEP] How to treat someone who calls you when you are fast asleep with 101 fvr? This is what I could do best.,25-34
"The fact that I have to sleep by myself tonight. <<<<<<< ???? [SEP] When people tell me I'm muggin all the time. No I'm not, that's just how my face looks expressionless. There's a difference. [SEP] Bitches be impressed by the most simplest shit. Like nigga pull up in a Audi for me & then I'm impressed. Flowers don't phase me, never did. [SEP] If you sub tweet someone that don't follow you or don't be on twitter. YOU'RE FUCKIN SCARY. ???????? [SEP] I been wearing my glasses for 3 days straight. I took them hoes off & couldn't see shit.",18-24
This weekend finna be >>>>>>>>>>>>>> ???? [SEP] Why won't these chargers stay IN THIS FUCK ASS WALL!!!!!!! ???? it's bed time for I punch a hole in the wall. ???? [SEP] Wtf don't my job understand about days off. If I'm off that don't mean you can call me in. Tf. I hate tht shit with a passion. [SEP] Auto Zone right now <<<<<<<< ???????????? [SEP] Discovery Channel >>>>>> shit be on point.,18-24
"I'm really craving some noodles in a cup & I don't eat noodles like that. #Weird [SEP] Damn, when it's gone rain?? I don't feel like taking my car to the car wash. Lmao.... ???????????? #ImSoSeriousTho [SEP] My car dirty afffffff. Inside & out. My parents would ring my neck if they seen it. Lol. [SEP] Serena & me childish af!! It's too early to be gettin this weak. ???????? [SEP] It feels good to finally lay down but not without you next to me. ???? #GoodNightFuckas",18-24
"I suck so bad at texting. [SEP] lol shut up!! I jus forget to text back. [SEP] It's just snuggles & me tonight. [SEP] Mann, I'm just tryna drink to get this shit off my mind. ???? [SEP] I SWEAR TO GOD EVERYONE IN SAN ANGELO DRIVE LIKE PUSSIES!! ????????",18-24
IHOP with my boooo.  We finna fuck some shit up. [SEP] I don't fuck with twitter no more. I been neglecting my phone period. [SEP] Either I need to find my glasses or make an appointment to get some new ones. Them hoes M.I.A & I NEED them. ???? [SEP] The struggle of being blind. <<<<<<<< ???? [SEP] Tommy right now <<<<<. ????,18-24
I don't feel like being at work. I just want to sleep. I'm soo tired. ???? [SEP] It's all about me now. I gotta do what I gotta do to make it in this world & make sure that I'm okay. #MeMyself&I [SEP] I'm hungry denna bitch. One more class & I can go smash some shit. [SEP] Me & my dad got into a big argument & he apologized. That's the first time I ever heard my daddy say I'm sorry. Means a lot. #MyNigga ???? [SEP] lmao. I forgot all about that.,18-24
I'm hungry & I want some chocolate chip cookies & I want to go home. I was not tryna come to work today. [SEP] Let me find out what I just did ain't in my job description. I'm checkin some shit. #GotMeFuckedUp [SEP] I just want a big fat ass chocolate chip cookie. [SEP] When my daddy calls my lil Regina......  ???? [SEP] What I woke up to this morning >>>>>>>>>>>>>>>>>> ????????????,18-24
"It took me 20 minutes to figure out how to reset my oil life since I got a oil change. Tf, it shouldn't have to be that hard. ???? [SEP] When irrelevant niggas text me tryna argue <<<<< #YoureDismissed #HoeAssNigga [SEP] These 2 days sleeping by myself is finna be hell!! ???? [SEP] I want to take my weave out for a little while, but dealing with my hair is a real struggle. I gotta big head with too much hair. ???? [SEP] Damn I ain't had corn in a cup in a while. That's my mission tomorrow, find some corn in a cup.",18-24
"Sometimes I wish I didn't have a car. Or better yet everyone I fucked with had a car. ???? [SEP] Fuck wrong with my phone. It's always some bullshit with this stupid ass brick!! [SEP] When bitches constantly talk about how much they don't need their ex, STFU if you don't need him then show it. Stop said it every 5 seconds. [SEP] I just had to say a prayer for my life. lol. [SEP] Lizzie in here killin the game. ????????????",18-24
Throw dat ass Lizzie!! ???? [SEP] When I wake Tommy up & he goes back to sleep......... ???????? [SEP] Dareus's paper he wrote for his English class >>>>>>>>>> [SEP] I'm too hungry right now. [SEP] If you ain't happy with your life then you ain't livin right. ????,18-24
Watching Superman for the billionth time. [SEP] One class tomorrow & no test >>>> ???? [SEP] 47 daysssss. #MyBirthday #20 ???????????? [SEP] My life >>>>> ???? [SEP] I'm finna go pay my girl Kim a visit. I missed her & so did my nails.,18-24
My whole weekend finna be <<<<<<<<< ???? [SEP] I need to take my ass to sleep. But I work all day tomorrow but I'm off on Saturday. [SEP] I'm not going to bed any time soon. ???? [SEP] Good thing I don't have class on Fridays. [SEP] I hope everyone had a beautiful Valentines Day. ??,18-24
"YAYYY. I miss her soo much. I miss my job. ???? [SEP] lol he'll noo. I do want to come visit cause my dad is there. [SEP] I'm sipping good, please don't worry bout what's in my cup. [SEP] These hoes let me drink a whole bottle of ciroc............... I'm drunk denna bitch. [SEP] It's crazy how fast the weather changes in Texas. But I'm not complaining.",18-24
what about your wiper blades doeee....? Lol. [SEP] lmaoooo. Boy stop it. But u can afford a whole chest piece & can't spend $12 on wiper blades. FOH [SEP] lol what ever. That's Gonna be you when it's pouring down raining & u can't see shit. [SEP] My brothers name on twitter >>>>>>>> ???????????????????????????????????????????? [SEP] lmao he Rlly don't. Never did & probably never will. That boy is something else.,18-24
What TF is life right now??? I'm too done with EVERYTHING. ???????????? [SEP] lol I'm just saying. What tat are u getting tho? [SEP] ayeeeeee that shit finna be live denna bitch!!! [SEP] Awwwwwwww Dareuss!!! ???? I just keep it real & you know I'm here to talk. ???? [SEP] girl my snap chat be fuckin up. I got this big ass brick.,18-24
Even tho Dareus & I broke up almost a year ago NOBODY or ANYTHING can break the bond that we have. ?? #FriendsForever [SEP] foreal. I just got this brick in June tho. But He gone come home from Korea & get a 5s.... Bald ass. [SEP] naw the Muse's don't fuck with Camaros. But he finna get me that Audi thooo. [SEP] hellllllll nawwww. Diamond will remain in my possession. That's my baby. [SEP] I need to fold my laundry but I'm TOOO tired too. ????,18-24
I can't be everywhere at once & I can't help everyone all the time. ???????? [SEP] I want to go out to eat or something. I haven't really seen my boo all week. ???? [SEP] When I eat chocolate at the beginning of the day before I eat & it tears my stomach up. <<< ???????? [SEP] Never wanted something more than I want this. ???? [SEP] Whyyyyyyyy did I take my weave out!!! #ICantDealWithThisShit ????,18-24
Some Korean food is calling my name. [SEP] I'm fuckin hungry. I should of ate when I got off work. But someone had a attitude...... ???? [SEP] Can't wait until my daddy comes home for good. [SEP] I just slept my whole math class away. Smh. I'm too tired. [SEP] I hate my history class. ????,18-24
"noooo. Why? You finally decided to get some windshield wipers?? Lol. [SEP] see!!!! Lol u should of been got em. But I can go up there & help u get them & put them on & stuff. [SEP] I don't get out of class until 3:15 cuhh. [SEP] In the name of Jesus, ???? huuaaahhh! [SEP] Only 4 hours of sleep.... This has to stop. Tommy always want to talk when it's time to go to bed. ????",18-24
I can't wait to come back home & go to sleep. [SEP] I want a peanut butter sandwich with bananas on it.  I miss youuuuu Domo!! ?????? [SEP] lol that doesn't make me weird. I drink strawberry milk too. But I be killin plain milk. [SEP] Preach it Andyy!!!! ???????? [SEP] lol I see that. Niggas need to know.,18-24
"not sure if there are notes for this particular presentation but anne's website has stuff: [SEP] thanks I think *smh* #nonethewiser [SEP] just reminded me of this bit of Workerist Dog Propaganda  #cciws13 [SEP] Go home, Australian political news, you're drunk. [SEP] absolutely!",35-49
Introduced to Alison Powell's work on SOPA/PIPA & 'technical activist actions' by  at #cciws13 [SEP] we must get  down here soon! You are doing UIC proud BTW. [SEP] isn't that over yet? [SEP] that looks so inviting [SEP] you'd probably get good lunches.,35-49
"If you can’t see that gender equality is...politics, you have no right to call yourself a political reporter. [SEP] Nothing like 's ultra-dry delivery to cut through the post-lunch slump #cciws13 [SEP] *has spent the past 7 minutes trying to figure out what 'apper' means* [SEP] yes Ben games studies invented fun [SEP] followed by ""who knew?""",35-49
"Oh dear, I think Ramon Lobato may have just suggested game studies is part of media studies #good #shitfightbut #cciws13 [SEP] Which is totally unfair because game studies invented play, materiality, bodies, and texts. [SEP] Anonymity as agency -  unpacking some unrecognised assumptions re identity & 'privacy' & names & bodies #cciws13 [SEP] now  is moving on to the #nymwars as a case of unsettled situation wrt identity, anonymity [SEP] is doing an ace job",35-49
"My Name is Me - a collective response to #nymwars - new to me, thanks  #cciws13 [SEP] #yeahgender “: gender mention (if only briefly) - yay!  #cciws13 [SEP] JOB: Continuing lectureship in Journalism & Media, University of Sydney (re-advertised) [SEP] Paper jammin' #cciws13  QUT Creative Industries Precinct [SEP] Phablet sighting.  at the cutting edge",35-49
"#cciws13 dinner: very conviviality [SEP] An amazing table of contents in this new collection Theorizing Cultural Work [SEP] yeah, library pricing. It's a thing. [SEP] oh dear [SEP] you should tell  - preaching to the converted telling me.",35-49
"material things in our research #cciws13 [SEP] CCI Gothic #cciws13 [SEP] I hadn't intended to characterize you as especially 'preachy', it's just a saying but yes point taken. [SEP] seems like it's turning into quite the 'side' project :) [SEP] how is ANYTHING in the news news anymore. #utterdespair #utter",35-49
"oh I see…this is probably unsurprising :) [SEP] the first and, I dearly hope, the last [SEP] did not. I am OK with Erving [SEP] I'm so glad we invited a couple of Scots to #cciws13. It's one of the hotter accents. [SEP] I have a very deep, almost biological suspicion of charisma. It's the scottish presbyterian in me.",35-49
provides several exs of how 'smoke' might appear in a Twitter corpus. On behalf of the ex-smokers THANKS A LOT AVI NOT #cciws13 [SEP] oh dear [SEP] There's been great progress on 's algorithm for identifying trustworthy social media disaster info since I saw it last! #cciws13 [SEP] has it occurred to you that you may be overly literal at times? [SEP] well at least you've got the accent,35-49
"I'm so impressed by the robust and generous intellectual engagement of everyone at #cciws13. I don't know how we magicked it up. [SEP] Um what exactly is the event that is happening in American democracy right now, mostly non-verbals in my stream [SEP] I ask,  delivers the info - Thank you!  Major filibuster (13 hours) in Texas to prevent legislation restricting abortion [SEP] thank you both as well :) [SEP] Thank you everyone! Epic feminist fillibuster in Texas to prevent anti-abortion lawmaking :)",35-49
"""Jason Potts"", ""Elinor Ostrom"", ""social network markets"" #bingobingobingo the board lights up #cciws13 [SEP] 'There is a lot of concerntrolling about ""the South"" as a place of abject horrors and inhumane acts...' [SEP] #cciws13 paper jamming with , aka 'Straight White Dudes Aren't All That, Bro'. [SEP] Awesome Pics, thank you! MT : Paper Jam hots up at  #CCIWS13. Facebook pics: [SEP] I think I will be grating my own earlobes at that time",35-49
"""hard"" and ""soft"" as modifiers of power/knowledge. #cciws13 OH THE GENDER [SEP] I need to get to the airport! [SEP] Most Australian universities have more professional support staff than academic staff [SEP] more like Days of Our Lives - Marlena is never really dead [SEP] we're excited about our learnings Jason",35-49
"The #auspol mob is visibly aroused. Drooling and jabbering. [SEP] I do but observe, sir. [SEP] There is basically no way TV journos can stay up to date because they can't refresh Twitter & speak to camera at the same time. #spill [SEP] oh dear [SEP] So excited to have (slightly jetlagged)  and  on deck in their new jobs at  and on hand at #cciws13",35-49
"Posting again wrt #cciws13 digital methods workshop: oldtweets, a search engine for the 1st yr of twitter [SEP] thank you! [SEP] oh cool [SEP] argh!!! What'd I miss? [SEP] great stuff darryl",35-49
"Um  just read out his own tweet. Is the a comment or a question. #cciws13 [SEP] I know, I do nothing but oppress your talent. [SEP] welcome to our thread [SEP] #cciws13 closing reception  Old Government House [SEP] #cciws closing reception - stopmotion version :)",35-49
"you gotta know when to fold 'em. [SEP] ""Attention is not necessarily a clumsy or insufficient proxy for physical touch but an autonomous source of pleasure"" [SEP] oh dear [SEP] I was wondering about similar issues for indexing indiv papers in the proceedings but didn't think of this one. [SEP] I thought so",35-49
"Congrats to  colleagues at QUT & RMIT, + our friends at UQ on your ARC Linkage success in FOR20 this round! [SEP] yes, fantastic. Thanks  for posting [SEP] related #cciws13 MT : How To Mess With Big Data Quant Folks—them: “so, what’s your n?” / you: “FEELINGS!” [SEP] Um so this is Vine posts on Twitter over past 2 months according to our data  #ripvine … [SEP] Woo hoo, congrats Dr   QUT Creative Industries Precinct",35-49
"YouTube Celebrates Pride With #ProudToLove Spotlight Channel [SEP] as i said, mad ambulance chasing skillz [SEP] OH at #cciws13 ""So I'm just trying to understand, if your brain is liquefied, how does knowledge transfer occur...?"" [SEP] how many academics need some basic speech and drama training. #alot [SEP] I DEMAND TANKS NAO #occupythefuture",35-49
i hope you completed your feedback forms earlier [SEP] i hope you'll remember the good times [SEP] now you're doing success theatre too? #killmenow [SEP] aw thanks guys. really good to hear. [SEP] and now Dad jokes.,35-49
totes rolling in it [SEP] yes these reports prompted us to check the data yesterday [SEP] it's how we roll [SEP] you should see ! [SEP] Hmmm so new MySpace or should I say InstaVinrSpot,35-49
"I just donated to #Movember, a cause i am passionate about - [SEP] Check out who is changing the face of men’s health for #Movember   via [SEP] . any ideas on date of acceptance notification? [SEP] #TwitterOwesMe $2. What's your account worth? [SEP] Any plans on performing in Belgium again? Loved your show in Kasterlee a couple of months ago !",25-34
"Google Scholar mistake: e-mail of 10 new citations of my articles, yet none cite me and not added to my overview [SEP] Welcome to , my 100th follower! [SEP] Sorry. [SEP] Worth to read his feed -> RT : Let's talk about Internet privacy. It's a hot topic lately. [SEP] Hardly any internet at work, yet facebook and twitter work fine #counterproductive",25-34
"Miley Cyrus appears to be more plausible than I thought for Time PoY [SEP] Santa’s Chief Data Scientist Speaks Out - Ecommerce Blog: [SEP] zelfs 2 fouten - University of Antwerpen [SEP] Except when its night in Africa RT : The total area of solar panels it would take to power the world [SEP] Post Plaza at Korenmarkt, Ghent is a former Post Office, not train station !",25-34
"Seems like permissions are not set right. Can’t access it. [SEP] I just became Tile backer 162585. Become a backer as well by getting yours at [SEP] Cool! Good luck with it... Who is collaborating? [SEP] Presenting poster on CSI corpus for stylometry and deception detection at #CLIN24 [SEP] ""How to improve your twitter engagement"" Put a ring on it?",25-34
"Brains hate randomness: Patterning skills for music and language in humans and other animals | CLiPS  via [SEP] We had a student mentioning the use of a 'sentimental lexicon' in his presentation :-D [SEP] Anxiously awaiting  workshop proposal notification :-) [SEP] nice post, but OUCH ! ""because it’s overall visual weight is mismanaged.” #typo [SEP] Sorry, can't help it! :-p Maybe just lowercase 'ouch' would've sufficed.",25-34
"Scientists explain their processes with a little too much honesty [17 pictures](via ) [SEP] I completed the  #HourofCode app! Check it out:  Fun way for newbies to learn programming [SEP] En wie is knappe professor? [SEP] . releases free Dutch corpus for comp. stylometry   Detect gender, personality, sentiment, deception in text [SEP] Personal Language Analytics for Sentiment Mining",25-34
"I'm loving this advertising by  that actually reflects the world we live in. (via ) [SEP] Programming in a nutshell  via [SEP] There is no link to the Author’s Kit here? the word just looks ‘linkish' [SEP] Ok, found it at the top of the page. But strange that in-text reference looks like link but isn’t. [SEP] Yes the figure of the circle is round indeed. All there's to be said about this graph.",25-34
Those too poor to afford it? [SEP] Yes! Finally some link to your source. Referencing is encouraged !! [SEP] says who? [SEP] Foto ! Pretty please? :) [SEP] Now I'm very curious,25-34
