text,age_label
"Going to work decked out in all zumiez apparel, shit i should just pose as a mannequin. [SEP] Switched rooms with my sister cause hers is always cold as fuck. & I like the cold [SEP] Ima try and sleep early tonight [SEP] Yo I honestly miss that feeling of being in a relationship [SEP] Don't ever make decisions when you're bared off Xanax. Woke up in my sisters room, and apparently I asked her last night if we could switch",18-24
"I just wanna move out of my moms house already man. I'd need at least two roommates who'd be not only down, but reliable. [SEP] My sisters nice enough to switch all out shit back and even clean my room while I'm at work. Lol [SEP] Off work, wassup for the night? [SEP] Fuck it. Im getting a mac. [SEP] Think my alphabet soup is trying to send me subliminal messages. ????",18-24
"Work [SEP] Honestly what does that Ice bucket challenge raise awareness for? [SEP] All the shit going on in this country, and in the world, and people dumping ice water on themselves to avoid donating to charity. [SEP] Idk man I just feel like this generation is fucked. [SEP] I've been watching this show called, continuum, and it's a trip. Corporations bail out the government, and they rule the country nowx",18-24
"Seems like some shit that's going on these days, I wouldn't be surprised if this country ends up like the show [SEP] And instead of ""anonymous"" they got ""Liber8"" [SEP] I'm just tryna stay alive and take care of my people [SEP] And they don't have no award for that [SEP] Why can't I ever go to sleep early like regular people",18-24
"I'm up listening to music thinking about how I'm 20 years old, and haven't accomplished anything I've wanted to so far in life ???? [SEP] Sad truth [SEP] Everything will fall into its place given time though [SEP] My mustache is getting long haha i haven't shaved it. [SEP] I look like this guy ----> ????",18-24
My hair be looking funky. [SEP] I want some horchata [SEP] I wanna act ballerific like it's all terrific. Got a few past due bills i won't get specific. [SEP] I got a problem with spending before I get it [SEP] We all self conscious I'm just the 2nd to admit it. (Yeezy was first),18-24
"???? Add me on snapchat for shit like this. ""AaronsRad"" [SEP] That beat doe! [SEP] Nigga I can't wait until I'm able to walk outside and it's cold as fuck [SEP] I got work at 5. Ughh [SEP] Just the other day my hair was long as fuck, and my face scrubby as hell now I can feel my scalp, and I got that baby face. Oh what a feelin",18-24
"Need a BP partner to help me run tables at tonight's kickback. Hmu if you're tryna get drunk, and be around good vibes! [SEP] For real for real [SEP] Like hop into my DMS if you want info, anyone is welcome. Preferably females [SEP] I've realized a lot... [SEP] Taking a piss to the rhythm of cricket music.",18-24
"I'm a fool man [SEP] School is about to start in two days. What.The.Fuck [SEP] I'd make a deal with the devil to have my life straightened out, and my mind clear [SEP] Work was a hoe today [SEP] When I was 18 and a girl was 2 years younger than me, I'd stay away. Now that 20, it's cool cause she'd be 18. Ain't that some shit",18-24
"This summer has been so wack that I really see no point in going out tonight but it's the last Saturday of summer so fuck it [SEP] I never learn [SEP] What's going on tonight? [SEP] Sometimes I think, I should've listened to my D.A.R.E. Officer. Fuck [SEP] Work was packed as fuck today but nonetheless, pretty chill",18-24
All these vma tweets on my TL got me weak lol [SEP] I want all the Nike Sb's at Zumiez. [SEP] I just want a good girl who will be bad just for me [SEP] Beyoncé ain't even all that in my opinion [SEP] I can't sleep,18-24
"She don't believe in shooting stars, but she believe in shoes and cars. [SEP] I haven't even printed out my schedule so I have no clue what buildings any of my classes are in [SEP] 3rd year of college, holy shit feels like just yesterday I was in my 3rd year of high school. [SEP] I hope there's a cute ass brunette with dimples in at least one of my classes. [SEP] I still gotta go and order my MacBook.",18-24
"My earliest class is at 9, that's not super early but fuck, I haven't even woke up anytime before 10 this whole summer ???? [SEP] Excited to start learning about music this semester. Ima be a dope producer one day you can count on that. [SEP] I wanna produce music for all the artists in my music library. Shit ain't impossible [SEP] So much shit I wanna do in life, music ain't the only thing [SEP] My ego as huge as kanyes, but I don't like to talk the talk, unless I know I can back up the walk.",18-24
"'Cant tell me nothing' one of my favorite Kanye songs. Random fact [SEP] Old folks talking bout back in my day. But homie this is my day, class started two hours ago, OH, am I late? [SEP] Is anyone else looking at their phones with one eye open right now or just me? [SEP] Falling down the same rabbit hole looking for love [SEP] Frank ocean is way overdue for a new album man",18-24
"If your life goals include a picture of Beyoncé, and her family, or of anyone else then you need to reevaluate your goals. Set your own [SEP] Taylor swift got negative booty cakes lmao [SEP] I'm starting to believe the woman of my dreams will only appear in my dreams [SEP] Can't wait for winter!!!!!!!!!!! [SEP] HAAAA, my last Retweet is on point",18-24
"Hanging Christmas lights at our apartment gives me the warm and fuzzies :) [SEP] Seasonally inappropriate movie and hot cocoa with  #notsleepingtonight #elorfanato [SEP] I woke up hating my life. #express #blackfriday [SEP] 3 COACH PURSES FOR THE PRICE OF ONE#blackfriday #stillcantaffordthis #ohwell [SEP] I don't just have a shopping addiction, I have a need for all things designer and sophisticated #ineedhelp",25-34
"Accidentally passed out for three hours what? #blackfriday [SEP] ""My spoon keeps hitting me in the eye.... White girl problems."" - [SEP] To say ""I needed today"" is a complete understatement :) #alltimehigh [SEP] I LOVE my Pflugies :) :) [SEP] The Pflugs are the family I grew up with. ""Pflugies"" is my affectionate name for them#sorryyourmindisinthegutter",25-34
"I will be referencing the Teenage Mutant Ninja Turtle's team bad boy, Raphael, multiple times in my Communication Analysis #getready [SEP] Starting the day with a party in my mouth! #nutella #hyperrr [SEP] WHERE ART THOU?! Come to the team room because I missss you!!! [SEP] Three running to-do lists= rough start to a rough week #overwhelmed [SEP] just attempted a Nerf gun sneak attack on me and epically failed. I'm embarrassed to call her my roommate",25-34
"thank goodness you jump-started your swag. otherwise, i don't think you would've made it out alive. [SEP] haircut. lauren and i are stylists [SEP] I don't know what to do with my night without Extemp practice... #nerd [SEP] Oh mah gawd. I am a pathetic, hopeless romantic. #whereismytruelooovveee [SEP] if you are 97 and I am 94 and we do not have spouses... wanna marry me?",25-34
"your ""for sure :)"" gave me such high hopes!! I know i will die alone now :( :( [SEP] I'll no longer be driving with expired plates and insurance! Yay for being a law-abiding citizen! #adultlife #responsibilities [SEP] Yay Jimmy I'm happy for you!! :) [SEP] I loved that last episode!!! Gah they are so adorable! [SEP] omgsh YES. After this week, major cuddle time needs to happen",25-34
I had a dream I was finally about to shop at H&M. Then I woke up to Yellowcard in my head and a not-memorized CA. #rufflife [SEP] So much sleep is going to happen tonight [SEP] NSYNC has a Christmas album and I never knew about it?!?! #WHAT?!?! #LIFEMADE [SEP] Omg Christmas decorating is amazing but Homestyle Mac and Cheese is terrible! #tipsytweet [SEP] stop studying! dance and be happy! don't let your worries get you down! you are great! silver shiny happiness :),25-34
"way to be creepy without being TOO creepy [SEP] It took me 40 minutes to drive home from work. And I lost control at least 4 times #snowdriving #canceleverything [SEP] ""You cheated on me? When I specifically asked you not to?"" #theoffice [SEP] I can't feel my legs..  happy birthdayyy.  your voice is amazing so dont stop singing girl luvz [SEP] You can't fix truly awful people. No matter how many redeeming qualities you try to bring out, they will always be a sucky person.",25-34
Why are dads so awkward? [SEP] AHAHAHAHAHAAHAHA omg!! That was the funniest tweet EVER!! [SEP] what the heck?! I was just at vi with lauren and pat... weird..... [SEP] I'll be at #express between 2 and 7:30 *hint hint wink wink* :) [SEP] i love that guy!,25-34
you should have come again! [SEP] god I LOVE that movie!!! Tell me next time you watch it!! [SEP] Thanks to everyone who visited me at work!! You made my day :) #ihavewonderfulfriends [SEP] but its soooo pretty long! [SEP] Only final is today at 1. Lezz get er done,25-34
"Yeah, this is the ""pretty much"" part. #duhdoi [SEP] #thatawfulmoment when you realize that everything you're teaching yourself for the final could've been useful to know during the semester [SEP] please say that's not real [SEP] I'm with RodgePodge [SEP] two halves of a heart. That way, when you put the tattoos together, they make a whole heart.",25-34
"PLEASE tell me you went with the sinner/saint one!!! [SEP] what?! I got to see Brod get his tattoos AND hold his hand. What a dumb policy. [SEP] *Italian* steak and potato dinner made by the very Italian  :) #pretentiousbutstillawesomeroomie [SEP] Why did like 5 of my facebook friends get in relationships TODAY? #ugh. [SEP] #Goingbeyondmygoal of reading the news everyday of break for Extemp, I just stayed up til 1:30 to watch the #GOPdebate. #entertained&annoyed",25-34
my apartment please! you can come over around 9. hope finals are going well :) [SEP] Work holiday party with  :) #bestdateever [SEP] Thanks for being a trooper tonight!! I can't wait until Friday ;) [SEP] I just......... wish teachers were paid more :( #thinkingaboutmyfinancialfuture [SEP] As long as they propose to us like this:  :) :),25-34
"I'm not sure what your definition of ""awkward"" is [SEP] ""Arizona immigration law: wat's up with dat?"" #KnowltonExtempQuestions [SEP] ""If Mitt Romney fell down in the woods and no one was around to hear it, would he make noise?"" #NickExtempQuestions [SEP] ""Herman Cain: Poised for a comeback?"" #KnowltonExtempQuestions [SEP] My mom sent me a Christmas eCard of woodland animals working together to make a snowman. It's freaking adorable :)",25-34
Overly aware of my inability to socialize with people who have ugly teeth. #sorryaboutit. At least  was there to save me [SEP] I was only totally cool with getting lost in residential south lincoln for a half hour because there are Christmas lights EVERYWHERE #lilkid [SEP] UGH. <----that's how I feel. [SEP] I dropped you off at home after you insisted on vacuuming the kitchen [SEP] and I are rocking the ballot out table #derp,25-34
"totally broke bro-code by fist-bumping me. #WINNING [SEP] I don't know what I would do without . He is such an amazing best friend. [SEP] Chasing with hot cocoa. This is the best thing that's ever happened to me!  :) :) :) [SEP] I'm living Vampire Weekend lyrics! ""In December drinking Horchata..."" [SEP] I'm trying to convince myself that a 3.2 GPA isn't terrible after the most time-consuming semester of my life #gladitsover",25-34
"At what point is too much sleep a bad thing? #accidental5hournaps #break [SEP] ,  literally just got home from seeing that moive......... [SEP] Daiquiris with  to forget about how awful ""New Years Eve"" was. [SEP] and I just accomplished one of our break goals: Crayon Art. #iamanartist #pinterest :) [SEP] 3rd 9-hour workday in a row :( #sotired :(",25-34
"i tweeted that i miss allie, then i tweeted ""and you and jess"". I JUST MISS YOU OK! [SEP] #Fun. is coming to Omaha on April 10, right after I get back from AFA to celebrate my 21st. I see this as a sign.... [SEP] and starting a ""Touchdown Turnaround"" chant! Wait... [SEP] All I care about today is treats. Treats and snoozin'. Snoozin' and treats. That's it. [SEP] I've never been so turned on by a description of cheesecake!!",25-34
"When do you come back to Lincoln?! I miss you soooooooo much!! [SEP] I wish my webcam worked so I could Skype you!! This distance is making me grow TOO fond of you [SEP] I'm quitting speech and dropping out of school to #scrapbook and #craft professionally [SEP] Definitely not the Christmas Eve I was hoping for [SEP] sonnie, i love how you call me grams! 402-637-6091 :)",25-34
"Jolly gosh!  really knows how to make a gal smile :) #bestgrandsonever [SEP] Actually Nick, I was hinting that you need to step up your game and make me smile more. :) [SEP] A ""Merry Christmas!"" at 12:01am from  was the best way to start the holiday :) #loveyoubestfriend [SEP] Kayleen came home for Christmas!!!! This was literally the only present I cared about :) #ilovemysister #merrychristmas :) [SEP] OH MAH GAWD THANK YOU!!",25-34
"To buy Cricut cutter, or not to buy Cricut cutter. #scrapbookingobsessed #oldladyproblems [SEP] my hero! what horrible timing though. The lights just HAD to stop working between my two ultimate crafting days... [SEP] haha but you should see my room!! and my car! you'd be so proud :) [SEP] Just baked yummy asparagus! Hooray for starting New Years resolutions early! #learningtocook #eatinghealthy [SEP] Keep calm and craft on",25-34
"""Everyone dies, and the goal is not to live forever. The goal is to create something that will"". [SEP] I don't want much, I just want some. [SEP] ""But these ships don't sail away, they wait they wait for another day. And they will float again."" [SEP] ""But I wish I never knew you, wish I never asked your name."" [SEP] ""We wish and all we do is wait.  We hope but never do we pray.""",18-24
"""Everyone wants a flame, but nobody wanna get burnt."" [SEP] Guachimently [SEP] Indirectas, indirectas everywhere... [SEP] Ve a Hogwarts. [SEP] ""I'll be home for next year, darling"".",18-24
"DIEGOOOO TU PODRÍAS SER CANTANTE SI NO FUERA POR LA VOZ!! [SEP] Life is brown like shit. [SEP] ""Im a sexual atheist."" [SEP] ooohhh me gustaaa crystal fighterssssssss!!! jajaja  ""Happy...... and fly like magic!"" :DDD [SEP] ""You and me, no one else, nothing else but us right now.""",18-24
"Feeling shocked. [SEP] I just don't know if i'm right or i'm wrong. [SEP] Unexpected things unexpectedly happen. [SEP] Fan de los ""Mitosis Synchronised Swimming"". [SEP] ""I feel something so wrong doing the right thing.""",18-24
"""We can have a walk in the mountains, we can do whatever. We can have a drink in the bar as long as we're together."" [SEP] ""When did you decide that nothing really matters anymore?"" [SEP] ""I never wanted anything from you, except everything you had and what was left after that too."" [SEP] Penn is in the air. [SEP] ""I wouldn't have nothing if I didn't have you"".",18-24
Life sucks. [SEP] This is Halloween... [SEP] Nocturnos for the win! [SEP] Relaxing cup of café con leche. #Oxímoron [SEP] Great minds think alike.,18-24
"""Maybe you are scared, maybe you just had enough of people talking bullshit. Had enough!"" [SEP] ""When it's a straight line baby, a straight line down"". [SEP] ""Falling in love is a crazy thing to do. It's kind of like a form of socially acceptable insanity"". [SEP] Nocturnal beings. [SEP] Why did I have to exist?",18-24
"#NowPlaying One night - Matthew Koma [SEP] Armstrong en la luna: ""So, Jesus walked on water?  THAT'S COOL."" [SEP] Y mira que no me suele gustar el rap pero...   ""was für Rap? Das is' Kunst, lass es bunt"" [SEP] ""Be the difference you want to see"". [SEP] Why did you have to come back?",18-24
"""Best friends are the people in your life that make you laugh louder, smile brighter, and live better"" [SEP] ""The sky wasn't big enough for them all"". [SEP] The king of the night. [SEP] Age of Mithology eran genialessssssssss jajajaj yo tengo comprado el normal y el Titans XD no jugaste al Age of Empires??? [SEP] WEHEEEEEEEEE!! Now i'm gold, bitches! XD",18-24
"Ya son las ocho y no he hecho NADA. [SEP] Matar a FAVs #Concepto [SEP] ""Take a lover who looks at you like maybe you are magic"". Frida Kahlo [SEP] Tried to be the main one. [SEP] ""Avoid the obvious.""",18-24
"""You gotta get up, and try"". [SEP] ""We should be facing the truth"". [SEP] #NP No Parachute - The Soldier Thread [SEP] Life doesn't wait for anyone. [SEP] SI SI SI SI SI i wanna be that 5/5 :$",18-24
"«Sed fugit interea, fugit irreparabile tempus» [SEP] ""I'm coming up only to show you wrong"" [SEP] ""But I'll tell you a secret: all the best people are."" [SEP] Ser un pocosfollowers con alma de tweetstar. #Concepto [SEP] It's hot tonight...",18-24
"""Home is wherever with you"". [SEP] HAZTE INDUSTRIAAAAAAAAAL! [SEP] ""The sky wasn't big enough for them all"". [SEP] MH, bitches. [SEP] muy acorde con tus últimos twitts :P",18-24
"TENGO QUE IRME YA A DORMIRRRRRR. [SEP] Juego con tus feelings. [SEP] Morgana Freeman. Nidalee Portman. Y así. [SEP] Not to be known. [SEP] ""Don't you know you have what I need"".",18-24
"""+ What do you say to the god of death? - Not today."" [SEP] This is not my day. [SEP] ""The only thing standing between you and your goal is the story you keep telling yourself as to why you can't achieve it"". [SEP] Tengo una chapa de Thresh Campeonatoooo wiiii [SEP] ""Hey yeah, dont let 'em know we're coming"".",18-24
"What am i looking for? [SEP] ""All I need is to find somebody"". [SEP] Un gran POS OC. [SEP] Fear closes doors. I lock them. [SEP] Noone said this would be easy, but noone said this was so hard.",18-24
"ODIO EL PUTO BUSCADOR DE TWITTER, JODER. [SEP] Ai temsion. [SEP] ""If you close your eyes, does it almost feel like nothing changed at all"". [SEP] HASTA EL COÑO YA! [SEP] ""There is evil in this world.""",18-24
"PIIIIIIIIIIIPOLLL JELP DE PIIIIIIIIIIIIIIPOOL [SEP] version flappyBirdy [SEP] ""But when the stars come out I want to be with you"" [SEP] HAURIA HAGUESSIM COMPRATTTTTTTTTTT [SEP] - Can you teleport? + Can't everyone? - Omfg you're right i've been so blind.",18-24
"CISPLATINO [SEP] Hitchcock proteins. [SEP] Perfect, but far away. [SEP] This guy makes ""Turtle"" mean ""God"". #LCS [SEP] Nyctophilia.",18-24
"not even close babe [SEP] ""Sometimes in life when people ask you how are you, you just say 'fine'"". [SEP] ""nEgri, you've spent about 5455 hours on LoL which means 227 days of your life.  You are 44th on EUW servers and 77th in the world."" [SEP] 3/14/2015 9.26.53. Will be ePIc. [SEP] ""I don't think i was asking for too much"".",18-24
"RT "": WHEN YOU TELL GRANDPA 60'S MUSIC WAS TRASH #KnockOutVines [SEP] I've been hurt so bad but I still love so hard. I admire my heart for that. [SEP] Girls these days.. [SEP] Yellow motherfucking claw ???? [SEP] Snow white successfully led on 7 short guys and ended up choosing the dude that was 6'4 if that ain't relevant to real life then idk what is",18-24
"RT "": Bach to back FIFA avond met [SEP] Bobby Shmurda is facing up to 25 years in prison for second degree murder yet Iggy Azalea is still free after killing music .. [SEP] ""will hump later""  ???????????????? [SEP] I love how liqour turns flat chests into mountains. [SEP] ???????????????????????????? "": when she slips a finger in your asshole",18-24
"She is still on my mind and sleep is hard to find. Everything reminds me that she's not beside me. [SEP] I do think of her and the ways that things were, when she was still there to guide me. [SEP] dont forget angry people. [SEP] This could be us but you keep playing. [SEP] I'm going crazy, but I will always use my best sence.",18-24
"Made it through a hurricane, so I'm celebrating with a Mary Jane. [SEP] I will unintionally offend you eventually, because you can't comprehend a different opinion. [SEP] It's funny how dumb people have smart phones. [SEP] This is what I wanna make, I don't care if it sells. [SEP] lol also cold as fuck, difficult langauge and next to Russia.",18-24
"RT "": When you're pre-gaming with your bros and the taxi shows up [SEP] I should get you baseball gloves for christmas, so you can catch feelings. [SEP] RT ????????????????"": When your girl says ""you aint getting none tonight""... but you already cheated [SEP] Rare film maar wel super tof. [SEP] that looks.like my local mc donalds.",18-24
"I'm signing off with a crotch grab. [SEP] GELD SLAAPT NOOIT, DAAROM BEN IK SNACHTS ALTIJD WAKKER. [SEP] Pfff, said yes didnt get it tho. No xmas present for me. [SEP] My hero [SEP] Parents ???? "": Damn that's real",18-24
"yeah lets eat a wasp, it's entire family will chase you, trying to kill you. [SEP] He's too strong to get to close to anyone, because everyone who promised they would stay, turned their backs and walked away. [SEP] WHERE CAN I PURCHASE THE SHOES FROM THE PICTURE? I LUV EM! [SEP] SUV swerving like it's O.J.'s car. [SEP] It's so late that it's early.",18-24
"I will give some a second chance for 2015.  Mistakes are forgotten, no footprints of any miss steps.    ???? [SEP] everybody hates greg [SEP] if you insist lolol nty [SEP] Nudes is a 5 letter word  Send is a 4 letter word  5 minus 4 equals 1  Just 1 nude can make anyone's day   Simple algebra. [SEP] the wife probably cheats because the nice husband is considered ""boring""",18-24
"thanks for the compliment [SEP] thats how I look when a bitch gives me a bad blowjob [SEP] RT "": We've all lost a good bro to a girl... R.I.P Old Best Friend"" [SEP] Someone with shit to hide is someone who I kick aside. [SEP] Stunt like a bitch.",18-24
"The adrinaline rush of creating what you think about... with who thinks about you. [SEP] yeah that would be fucking intents. [SEP] thats not much I can drink that easely in a day with coca cola [SEP] When you in bed watching Netflix all night and you keep getting disturbt... [SEP] Okay, I defo found my new tv show to watch. Sons of anarchy. ????",18-24
"Seen all them kewl shows on netflix already glad i found another one. [SEP] When a girl tells me I'm a good kisser but she still won't let me hit yet. [SEP] NEW YEARS EVE GOT ME LIKE [SEP] JE KAN ME VERLATEN IN 2015 IDGAF, M'N VADER STARTE DIE TREND IN 2007. [SEP] All I wear last king's gear man that shit so ill.",18-24
"Iz u down is my teamsong take your thong of put me on. [SEP] The only thing worse than everyone knowing is that no one knows.. [SEP] We the cause of all the comotion. [SEP] Voices in my head? I need choices in my bed. [SEP] Gekkigheid "": The haunted forest",18-24
"Girl you fucking with the best, take a picture while I'm deep up in it. And if they living right next, I bet they know my name in a minute. [SEP] i know bro ???????? BMS the best. [SEP] When you hand me the AUX-cord. [SEP] At the snackbar being order 69, bitch knowns whats up. [SEP] I'm still drunk to you",18-24
"No matter what we breed, we are still made of greed. [SEP] Every high school and college girl ever [SEP] When momma says I need to stop playing those videogames. [SEP] When people say really mean things to you.. [SEP] RT "": my ""won't speak until i'm spoken to"" game is strong af.""",18-24
"You know what fame is? Sitting with the woman of your dreams and forgetting what her name is. [SEP] where did it end [SEP] why the fuck he chilling with headphones [SEP] FIFA THINGS "": When your strike partner shoots instead of laying it off to you for an open goal.. [SEP] She rides me when the lights go off she climbes on top, her body rocking we don't stop.",18-24
"She ride me like a pro, she did this before.. I hold her tight no letting go till she says she cant take no more. [SEP] Im speechless. All I say is oooh oooh [SEP] tell that the muslims lol [SEP] What’s the difference between a knife and a female arguing?  A knife has a point. [SEP] lol how you get all those hoes",18-24
A long time I've been alone. For years in a house but it wasn't a home. I've made brothers of a different kind instead. [SEP] I will not be commanded.  I will not be controlled.  And I will not let my future go on without the help of my soul. [SEP] the woman from the pic can be my baby momma aswell [SEP] also a beautiful face I'd like to nut all over [SEP] Wingman 2.0 right here,18-24
"You were not feeling me, cause I was not feeling 'we'. [SEP] Ya'll just some major haters and some math minors. [SEP] WHEN THE ALCOHOL KICKS IN [SEP] Baby you're fired, your girlfriend hired. [SEP] what????",18-24
"RT "": shoutout to the friends that still like me  all two of you"" [SEP] lol i knew this day would come. [SEP] what a thot [SEP] K RINO - Grand deception ???????????????? [SEP] Barber : what do u want?  Client : you know that moment when you pour your milk into your tea?  Barber : say no more",18-24
GET ME SOME SLOOTS [SEP] Flaws ain't flaws when it's you that make the calls! [SEP] Ty Dolla $ign ft. Wiz Khalifa & DJ Mustard - or nah remix ???????????? [SEP] I can only imagine how it feels like.. [SEP] Kanye during the day Drake at night,18-24
"On my very last Nerve! [SEP] I am nothing and I have nothing but Allah! [SEP] ...from the corner of my dreams! [SEP] Masha Allah! : Then, you have everything . "": I am nothing and I have nothing but Allah! [SEP] Stay relaxed, be at peace, without anxieties, be in conversations that makes sense. Happy...",25-34
"We ask for nothing but will give everything if we have to. [SEP] Be kind, no matter what... It's a priceless legacy to leave behind. [SEP] When the waves of trouble looks beautiful in the sky... [SEP] Not a witch... Merely bewitching... [SEP] Lol! : “: When the waves of trouble looks beautiful in the sky...” Toh fa,kaji zaurance da Turanci.”",25-34
